    1 0.000000000 fe80::70ba:f5ff:fe50:e7a2 → ff02::2      ICMPv6 72 Router Solicitation from 72:ba:f5:50:e7:a2
    2 0.000000000 fe80::9011:5bff:fe43:a202 → ff02::2      ICMPv6 72 Router Solicitation from 92:11:5b:43:a2:02
    3 0.160416800 fe80::7046:95ff:feb4:ad15 → ff02::2      ICMPv6 72 Router Solicitation from 72:46:95:b4:ad:15
    4 0.320575700 02:42:0a:c8:00:03 →              ARP 44 Who has 10.200.0.2? Tell 10.200.0.3
    5 0.320598200 02:42:0a:c8:00:02 →              ARP 44 10.200.0.2 is at 02:42:0a:c8:00:02
    6 6.830101200   10.100.0.2 → 224.0.0.5    OSPF 80 Hello Packet
    7 6.830123800   10.100.0.2 → 224.0.0.5    OSPF 80 Hello Packet
    8 6.830885300   10.200.0.2 → 224.0.0.5    OSPF 80 Hello Packet
    9 6.830890800   10.200.0.2 → 224.0.0.5    OSPF 80 Hello Packet
   10 6.831311400     10.1.0.2 → 224.0.0.5    OSPF 84 Hello Packet
   11 6.831316000     10.1.0.2 → 224.0.0.5    OSPF 84 Hello Packet
   12 6.940555200     10.1.0.3 → 224.0.0.5    OSPF 84 Hello Packet
   13 7.999997000 fe80::7046:95ff:feb4:ad15 → ff02::2      ICMPv6 72 Router Solicitation from 72:46:95:b4:ad:15
   14 8.639990900 fe80::9011:5bff:fe43:a202 → ff02::2      ICMPv6 72 Router Solicitation from 92:11:5b:43:a2:02
   15 8.640030600 fe80::70ba:f5ff:fe50:e7a2 → ff02::2      ICMPv6 72 Router Solicitation from 72:ba:f5:50:e7:a2
   16 11.840351600 02:42:0a:01:00:03 →              ARP 44 Who has 10.1.0.2? Tell 10.1.0.3
   17 11.840365500 02:42:0a:01:00:02 →              ARP 44 10.1.0.2 is at 02:42:0a:01:00:02
   18 16.830139700   10.100.0.2 → 224.0.0.5    OSPF 80 Hello Packet
   19 16.830159100   10.100.0.2 → 224.0.0.5    OSPF 80 Hello Packet
   20 16.830888100   10.200.0.2 → 224.0.0.5    OSPF 80 Hello Packet
   21 16.830893500   10.200.0.2 → 224.0.0.5    OSPF 80 Hello Packet
   22 16.831339600     10.1.0.2 → 224.0.0.5    OSPF 84 Hello Packet
   23 16.831350300     10.1.0.2 → 224.0.0.5    OSPF 84 Hello Packet
   24 16.940580700     10.1.0.3 → 224.0.0.5    OSPF 84 Hello Packet
   25 23.360296000 fe80::7046:95ff:feb4:ad15 → ff02::2      ICMPv6 72 Router Solicitation from 72:46:95:b4:ad:15
   26 24.560764100 02:42:0a:01:00:02 →              ARP 44 Who has 10.1.0.3? Tell 10.1.0.2
   27 24.560838500 02:42:0a:01:00:03 →              ARP 44 10.1.0.3 is at 02:42:0a:01:00:03
   28 24.640996500 fe80::9011:5bff:fe43:a202 → ff02::2      ICMPv6 72 Router Solicitation from 92:11:5b:43:a2:02
   29 25.280369100 fe80::70ba:f5ff:fe50:e7a2 → ff02::2      ICMPv6 72 Router Solicitation from 72:ba:f5:50:e7:a2
   30 26.830617600   10.100.0.2 → 224.0.0.5    OSPF 80 Hello Packet
   31 26.830665300   10.100.0.2 → 224.0.0.5    OSPF 80 Hello Packet
   32 26.831317800   10.200.0.2 → 224.0.0.5    OSPF 80 Hello Packet
   33 26.831332800   10.200.0.2 → 224.0.0.5    OSPF 80 Hello Packet
   34 26.831728200     10.1.0.2 → 224.0.0.5    OSPF 84 Hello Packet
   35 26.831734000     10.1.0.2 → 224.0.0.5    OSPF 84 Hello Packet
   36 26.941005600     10.1.0.3 → 224.0.0.5    OSPF 84 Hello Packet
   37 36.830574300   10.100.0.2 → 224.0.0.5    OSPF 80 Hello Packet
   38 36.830593000   10.100.0.2 → 224.0.0.5    OSPF 80 Hello Packet
   39 36.830764200     10.1.0.2 → 10.1.0.3     OSPF 68 DB Description
   40 36.831314400   10.200.0.2 → 224.0.0.5    OSPF 80 Hello Packet
   41 36.831324700   10.200.0.2 → 224.0.0.5    OSPF 80 Hello Packet
   42 36.831730200     10.1.0.2 → 224.0.0.5    OSPF 84 Hello Packet
   43 36.831734100     10.1.0.2 → 224.0.0.5    OSPF 84 Hello Packet
   44 36.940005700     10.1.0.3 → 10.1.0.2     OSPF 68 DB Description
   45 36.940978100     10.1.0.3 → 224.0.0.5    OSPF 84 Hello Packet
   46 41.831618200     10.1.0.2 → 10.1.0.3     OSPF 68 DB Description
   47 41.831911400     10.1.0.3 → 10.1.0.2     OSPF 88 DB Description
   48 41.832171900     10.1.0.2 → 10.1.0.3     OSPF 88 DB Description
   49 41.832249100     10.1.0.2 → 10.1.0.3     OSPF 72 LS Request
   50 41.832322400     10.1.0.3 → 10.1.0.2     OSPF 68 DB Description
   51 41.832385200     10.1.0.3 → 10.1.0.2     OSPF 72 LS Request
   52 41.832416100     10.1.0.3 → 224.0.0.5    OSPF 124 LS Update
   53 41.832470800     10.1.0.2 → 224.0.0.5    OSPF 124 LS Update
   54 41.832480400     10.1.0.2 → 224.0.0.5    OSPF 124 LS Update
   55 41.832625200     10.1.0.2 → 224.0.0.5    OSPF 156 LS Update
   56 41.832632200     10.1.0.2 → 224.0.0.5    OSPF 156 LS Update
   57 41.832731800   10.200.0.2 → 10.200.0.3   TCP 178 36335 → 5140 [PSH, ACK] Seq=1 Ack=1 Win=502 Len=110 TSval=2381125463 TSecr=1027964214
   58 41.832749900     10.1.0.3 → 224.0.0.5    OSPF 124 LS Update
   59 41.832793000   10.200.0.3 → 10.200.0.2   TCP 68 5140 → 36335 [ACK] Seq=1 Ack=111 Win=503 Len=0 TSval=1028009546 TSecr=2381125463
   60 41.836861400     10.1.0.3 → 224.0.0.5    OSPF 124 LS Update
   61 41.836980700     10.1.0.3 → 224.0.0.5    OSPF 124 LS Update
   62 41.837070400     10.1.0.3 → 224.0.0.5    OSPF 96 LS Update
   63 41.840468200 02:42:0a:01:00:03 →              ARP 44 Who has 10.1.0.2? Tell 10.1.0.3
   64 41.840475700 02:42:0a:01:00:02 →              ARP 44 10.1.0.2 is at 02:42:0a:01:00:02
   65 41.941374200     10.1.0.3 → 224.0.0.5    OSPF 124 LS Update
   66 41.941500100     10.1.0.3 → 224.0.0.5    OSPF 156 LS Update
   67 41.943182000     10.1.0.3 → 224.0.0.5    OSPF 100 LS Acknowledge
   68 42.141187600   10.200.0.2 → 10.200.0.3   TCP 140 36335 → 5140 [PSH, ACK] Seq=111 Ack=1 Win=502 Len=72 TSval=2381125771 TSecr=1028009546
   69 42.141238100   10.200.0.3 → 10.200.0.2   TCP 68 5140 → 36335 [ACK] Seq=1 Ack=183 Win=503 Len=0 TSval=1028009854 TSecr=2381125771
   70 42.832761700     10.1.0.2 → 224.0.0.5    OSPF 160 LS Acknowledge
   71 42.832785200     10.1.0.2 → 224.0.0.5    OSPF 160 LS Acknowledge
   72 46.830606100   10.100.0.2 → 224.0.0.5    OSPF 80 Hello Packet
   73 46.830636700   10.100.0.2 → 224.0.0.5    OSPF 80 Hello Packet
   74 46.831315200   10.200.0.2 → 224.0.0.5    OSPF 80 Hello Packet
   75 46.831321400   10.200.0.2 → 224.0.0.5    OSPF 80 Hello Packet
   76 46.831733100     10.1.0.2 → 224.0.0.5    OSPF 84 Hello Packet
   77 46.831737900     10.1.0.2 → 224.0.0.5    OSPF 84 Hello Packet
   78 46.880426500 02:42:0a:c8:00:03 →              ARP 44 Who has 10.200.0.2? Tell 10.200.0.3
   79 46.880434900 02:42:0a:c8:00:02 →              ARP 44 10.200.0.2 is at 02:42:0a:c8:00:02
   80 46.941034300     10.1.0.3 → 224.0.0.5    OSPF 84 Hello Packet
   81 51.832059400     10.1.0.3 → 10.1.0.2     OSPF 124 LS Update
   82 51.832324600     10.1.0.2 → 10.1.0.3     OSPF 124 LS Update
   83 51.836501900     10.1.0.3 → 224.0.0.5    OSPF 124 LS Update
   84 51.836578700     10.1.0.2 → 224.0.0.5    OSPF 80 LS Acknowledge
   85 51.836589200     10.1.0.2 → 224.0.0.5    OSPF 80 LS Acknowledge
   86 51.941075000     10.1.0.3 → 224.0.0.5    OSPF 124 LS Update
   87 51.946404800     10.1.0.3 → 224.0.0.5    OSPF 80 LS Acknowledge
   88 52.800450100 fe80::7046:95ff:feb4:ad15 → ff02::2      ICMPv6 72 Router Solicitation from 72:46:95:b4:ad:15
   89 52.836896300     10.1.0.2 → 224.0.0.5    OSPF 100 LS Acknowledge
   90 52.836913600     10.1.0.2 → 224.0.0.5    OSPF 100 LS Acknowledge
   91 56.640941400 fe80::9011:5bff:fe43:a202 → ff02::2      ICMPv6 72 Router Solicitation from 92:11:5b:43:a2:02
   92 56.830568700   10.100.0.2 → 224.0.0.5    OSPF 80 Hello Packet
   93 56.830587400   10.100.0.2 → 224.0.0.5    OSPF 80 Hello Packet
   94 56.831275500   10.200.0.2 → 224.0.0.5    OSPF 80 Hello Packet
   95 56.831280600   10.200.0.2 → 224.0.0.5    OSPF 80 Hello Packet
   96 56.831693600     10.1.0.2 → 224.0.0.5    OSPF 84 Hello Packet
   97 56.831698100     10.1.0.2 → 224.0.0.5    OSPF 84 Hello Packet
   98 56.880833500 02:42:0a:01:00:02 →              ARP 44 Who has 10.1.0.3? Tell 10.1.0.2
   99 56.880945200 02:42:0a:01:00:03 →              ARP 44 10.1.0.3 is at 02:42:0a:01:00:03
  100 56.941161900     10.1.0.3 → 224.0.0.5    OSPF 84 Hello Packet
  101 57.920713300 fe80::70ba:f5ff:fe50:e7a2 → ff02::2      ICMPv6 72 Router Solicitation from 72:ba:f5:50:e7:a2
  102 59.840857500     10.1.0.1 → 10.200.0.3   TCP 76 43933 → 5140 [SYN] Seq=0 Win=64240 Len=0 MSS=1460 SACK_PERM=1 TSval=4111528032 TSecr=0 WS=128
  103 59.840870100     10.1.0.1 → 10.200.0.3   TCP 76 [TCP Out-Of-Order] [TCP Port numbers reused] 43933 → 5140 [SYN] Seq=0 Win=64240 Len=0 MSS=1460 SACK_PERM=1 TSval=4111528032 TSecr=0 WS=128
  104 60.480927900     10.1.0.3 → 10.200.0.3   TCP 76 35547 → 5140 [SYN] Seq=0 Win=64240 Len=0 MSS=1460 SACK_PERM=1 TSval=4092381614 TSecr=0 WS=128
  105 60.480943300     10.1.0.3 → 10.200.0.3   TCP 76 [TCP Out-Of-Order] [TCP Port numbers reused] 35547 → 5140 [SYN] Seq=0 Win=64240 Len=0 MSS=1460 SACK_PERM=1 TSval=4092381614 TSecr=0 WS=128
  106 60.480978300   10.200.0.3 → 10.1.0.3     TCP 76 5140 → 35547 [SYN, ACK] Seq=0 Ack=1 Win=65160 Len=0 MSS=1460 SACK_PERM=1 TSval=1241596254 TSecr=4092381614 WS=128
  107 60.480983600   10.200.0.3 → 10.1.0.3     TCP 76 [TCP Out-Of-Order] 5140 → 35547 [SYN, ACK] Seq=0 Ack=1 Win=65160 Len=0 MSS=1460 SACK_PERM=1 TSval=1241596254 TSecr=4092381614 WS=128
  108 60.481013500     10.1.0.3 → 10.200.0.3   TCP 68 35547 → 5140 [ACK] Seq=1 Ack=1 Win=64256 Len=0 TSval=4092381614 TSecr=1241596254
  109 60.481015700     10.1.0.3 → 10.200.0.3   TCP 68 [TCP Dup ACK 108#1] 35547 → 5140 [ACK] Seq=1 Ack=1 Win=64256 Len=0 TSval=4092381614 TSecr=1241596254
  110 60.481018000     10.1.0.1 → 10.200.0.3   TCP 76 35879 → 5140 [SYN] Seq=0 Win=64240 Len=0 MSS=1460 SACK_PERM=1 TSval=1005263803 TSecr=0 WS=128
  111 60.481023700     10.1.0.1 → 10.200.0.3   TCP 76 [TCP Out-Of-Order] [TCP Port numbers reused] 35879 → 5140 [SYN] Seq=0 Win=64240 Len=0 MSS=1460 SACK_PERM=1 TSval=1005263803 TSecr=0 WS=128
  112 60.481538600     10.1.0.3 → 10.200.0.3   TCP 151 35547 → 5140 [PSH, ACK] Seq=1 Ack=1 Win=64256 Len=83 TSval=4092381614 TSecr=1241596254
  113 60.481549200     10.1.0.3 → 10.200.0.3   TCP 151 [TCP Retransmission] 35547 → 5140 [PSH, ACK] Seq=1 Ack=1 Win=64256 Len=83 TSval=4092381614 TSecr=1241596254
  114 60.481618200   10.200.0.3 → 10.1.0.3     TCP 68 5140 → 35547 [ACK] Seq=1 Ack=84 Win=65152 Len=0 TSval=1241596254 TSecr=4092381614
  115 60.481625200   10.200.0.3 → 10.1.0.3     TCP 68 [TCP Dup ACK 114#1] 5140 → 35547 [ACK] Seq=1 Ack=84 Win=65152 Len=0 TSval=1241596254 TSecr=4092381614
  116 60.481659800     10.1.0.3 → 10.200.0.3   TCP 153 35547 → 5140 [PSH, ACK] Seq=84 Ack=1 Win=64256 Len=85 TSval=4092381615 TSecr=1241596254
  117 60.481663100     10.1.0.3 → 10.200.0.3   TCP 153 [TCP Retransmission] 35547 → 5140 [PSH, ACK] Seq=84 Ack=1 Win=64256 Len=85 TSval=4092381615 TSecr=1241596254
  118 60.481676600   10.200.0.3 → 10.1.0.3     TCP 68 5140 → 35547 [ACK] Seq=1 Ack=169 Win=65152 Len=0 TSval=1241596255 TSecr=4092381615
  119 60.481679500   10.200.0.3 → 10.1.0.3     TCP 68 [TCP Dup ACK 118#1] 5140 → 35547 [ACK] Seq=1 Ack=169 Win=65152 Len=0 TSval=1241596255 TSecr=4092381615
  120 60.481702600     10.1.0.3 → 10.200.0.3   TCP 180 35547 → 5140 [PSH, ACK] Seq=169 Ack=1 Win=64256 Len=112 TSval=4092381615 TSecr=1241596255
  121 60.481705500     10.1.0.3 → 10.200.0.3   TCP 180 [TCP Retransmission] 35547 → 5140 [PSH, ACK] Seq=169 Ack=1 Win=64256 Len=112 TSval=4092381615 TSecr=1241596255
  122 60.481716000   10.200.0.3 → 10.1.0.3     TCP 68 5140 → 35547 [ACK] Seq=1 Ack=281 Win=65152 Len=0 TSval=1241596255 TSecr=4092381615
  123 60.481717600   10.200.0.3 → 10.1.0.3     TCP 68 [TCP Dup ACK 122#1] 5140 → 35547 [ACK] Seq=1 Ack=281 Win=65152 Len=0 TSval=1241596255 TSecr=4092381615
  124 60.481732900     10.1.0.3 → 10.200.0.3   TCP 179 35547 → 5140 [PSH, ACK] Seq=281 Ack=1 Win=64256 Len=111 TSval=4092381615 TSecr=1241596255
  125 60.481735500     10.1.0.3 → 10.200.0.3   TCP 179 [TCP Retransmission] 35547 → 5140 [PSH, ACK] Seq=281 Ack=1 Win=64256 Len=111 TSval=4092381615 TSecr=1241596255
  126 60.481745300   10.200.0.3 → 10.1.0.3     TCP 68 5140 → 35547 [ACK] Seq=1 Ack=392 Win=65152 Len=0 TSval=1241596255 TSecr=4092381615
  127 60.481746800   10.200.0.3 → 10.1.0.3     TCP 68 [TCP Dup ACK 126#1] 5140 → 35547 [ACK] Seq=1 Ack=392 Win=65152 Len=0 TSval=1241596255 TSecr=4092381615
  128 60.481759500     10.1.0.3 → 10.200.0.3   TCP 180 35547 → 5140 [PSH, ACK] Seq=392 Ack=1 Win=64256 Len=112 TSval=4092381615 TSecr=1241596255
  129 60.481761000     10.1.0.3 → 10.200.0.3   TCP 180 [TCP Retransmission] 35547 → 5140 [PSH, ACK] Seq=392 Ack=1 Win=64256 Len=112 TSval=4092381615 TSecr=1241596255
  130 60.481767500   10.200.0.3 → 10.1.0.3     TCP 68 5140 → 35547 [ACK] Seq=1 Ack=504 Win=65152 Len=0 TSval=1241596255 TSecr=4092381615
  131 60.481768700   10.200.0.3 → 10.1.0.3     TCP 68 [TCP Dup ACK 130#1] 5140 → 35547 [ACK] Seq=1 Ack=504 Win=65152 Len=0 TSval=1241596255 TSecr=4092381615
  132 60.481777900     10.1.0.3 → 10.200.0.3   TCP 182 35547 → 5140 [PSH, ACK] Seq=504 Ack=1 Win=64256 Len=114 TSval=4092381615 TSecr=1241596255
  133 60.481779400     10.1.0.3 → 10.200.0.3   TCP 182 [TCP Retransmission] 35547 → 5140 [PSH, ACK] Seq=504 Ack=1 Win=64256 Len=114 TSval=4092381615 TSecr=1241596255
  134 60.481784800   10.200.0.3 → 10.1.0.3     TCP 68 5140 → 35547 [ACK] Seq=1 Ack=618 Win=65152 Len=0 TSval=1241596255 TSecr=4092381615
  135 60.481785800   10.200.0.3 → 10.1.0.3     TCP 68 [TCP Dup ACK 134#1] 5140 → 35547 [ACK] Seq=1 Ack=618 Win=65152 Len=0 TSval=1241596255 TSecr=4092381615
  136 60.481794600     10.1.0.3 → 10.200.0.3   TCP 197 35547 → 5140 [PSH, ACK] Seq=618 Ack=1 Win=64256 Len=129 TSval=4092381615 TSecr=1241596255
  137 60.481795900     10.1.0.3 → 10.200.0.3   TCP 197 [TCP Retransmission] 35547 → 5140 [PSH, ACK] Seq=618 Ack=1 Win=64256 Len=129 TSval=4092381615 TSecr=1241596255
  138 60.481801300   10.200.0.3 → 10.1.0.3     TCP 68 5140 → 35547 [ACK] Seq=1 Ack=747 Win=65024 Len=0 TSval=1241596255 TSecr=4092381615
  139 60.481802400   10.200.0.3 → 10.1.0.3     TCP 68 [TCP Dup ACK 138#1] 5140 → 35547 [ACK] Seq=1 Ack=747 Win=65024 Len=0 TSval=1241596255 TSecr=4092381615
  140 60.481811400     10.1.0.3 → 10.200.0.3   TCP 153 35547 → 5140 [PSH, ACK] Seq=747 Ack=1 Win=64256 Len=85 TSval=4092381615 TSecr=1241596255
  141 60.481812700     10.1.0.3 → 10.200.0.3   TCP 153 [TCP Retransmission] 35547 → 5140 [PSH, ACK] Seq=747 Ack=1 Win=64256 Len=85 TSval=4092381615 TSecr=1241596255
  142 60.481817900   10.200.0.3 → 10.1.0.3     TCP 68 5140 → 35547 [ACK] Seq=1 Ack=832 Win=65024 Len=0 TSval=1241596255 TSecr=4092381615
  143 60.481819000   10.200.0.3 → 10.1.0.3     TCP 68 [TCP Dup ACK 142#1] 5140 → 35547 [ACK] Seq=1 Ack=832 Win=65024 Len=0 TSval=1241596255 TSecr=4092381615
  144 60.481827700     10.1.0.3 → 10.200.0.3   TCP 151 35547 → 5140 [PSH, ACK] Seq=832 Ack=1 Win=64256 Len=83 TSval=4092381615 TSecr=1241596255
  145 60.481829000     10.1.0.3 → 10.200.0.3   TCP 151 [TCP Retransmission] 35547 → 5140 [PSH, ACK] Seq=832 Ack=1 Win=64256 Len=83 TSval=4092381615 TSecr=1241596255
  146 60.481834300   10.200.0.3 → 10.1.0.3     TCP 68 5140 → 35547 [ACK] Seq=1 Ack=915 Win=65024 Len=0 TSval=1241596255 TSecr=4092381615
  147 60.481835400   10.200.0.3 → 10.1.0.3     TCP 68 [TCP Dup ACK 146#1] 5140 → 35547 [ACK] Seq=1 Ack=915 Win=65024 Len=0 TSval=1241596255 TSecr=4092381615
  148 60.481844000     10.1.0.3 → 10.200.0.3   TCP 151 35547 → 5140 [PSH, ACK] Seq=915 Ack=1 Win=64256 Len=83 TSval=4092381615 TSecr=1241596255
  149 60.481845300     10.1.0.3 → 10.200.0.3   TCP 151 [TCP Retransmission] 35547 → 5140 [PSH, ACK] Seq=915 Ack=1 Win=64256 Len=83 TSval=4092381615 TSecr=1241596255
  150 60.481850500   10.200.0.3 → 10.1.0.3     TCP 68 5140 → 35547 [ACK] Seq=1 Ack=998 Win=65024 Len=0 TSval=1241596255 TSecr=4092381615
  151 60.481851600   10.200.0.3 → 10.1.0.3     TCP 68 [TCP Dup ACK 150#1] 5140 → 35547 [ACK] Seq=1 Ack=998 Win=65024 Len=0 TSval=1241596255 TSecr=4092381615
  152 60.481860000     10.1.0.3 → 10.200.0.3   TCP 150 35547 → 5140 [PSH, ACK] Seq=998 Ack=1 Win=64256 Len=82 TSval=4092381615 TSecr=1241596255
  153 60.481861300     10.1.0.3 → 10.200.0.3   TCP 150 [TCP Retransmission] 35547 → 5140 [PSH, ACK] Seq=998 Ack=1 Win=64256 Len=82 TSval=4092381615 TSecr=1241596255
  154 60.481866600   10.200.0.3 → 10.1.0.3     TCP 68 5140 → 35547 [ACK] Seq=1 Ack=1080 Win=65024 Len=0 TSval=1241596255 TSecr=4092381615
  155 60.481867600   10.200.0.3 → 10.1.0.3     TCP 68 [TCP Dup ACK 154#1] 5140 → 35547 [ACK] Seq=1 Ack=1080 Win=65024 Len=0 TSval=1241596255 TSecr=4092381615
  156 60.481877000     10.1.0.3 → 10.200.0.3   TCP 158 35547 → 5140 [PSH, ACK] Seq=1080 Ack=1 Win=64256 Len=90 TSval=4092381615 TSecr=1241596255
  157 60.481878400     10.1.0.3 → 10.200.0.3   TCP 158 [TCP Retransmission] 35547 → 5140 [PSH, ACK] Seq=1080 Ack=1 Win=64256 Len=90 TSval=4092381615 TSecr=1241596255
  158 60.481883600   10.200.0.3 → 10.1.0.3     TCP 68 5140 → 35547 [ACK] Seq=1 Ack=1170 Win=65024 Len=0 TSval=1241596255 TSecr=4092381615
  159 60.481884700   10.200.0.3 → 10.1.0.3     TCP 68 [TCP Dup ACK 158#1] 5140 → 35547 [ACK] Seq=1 Ack=1170 Win=65024 Len=0 TSval=1241596255 TSecr=4092381615
  160 60.481893300     10.1.0.3 → 10.200.0.3   TCP 158 35547 → 5140 [PSH, ACK] Seq=1170 Ack=1 Win=64256 Len=90 TSval=4092381615 TSecr=1241596255
  161 60.481894600     10.1.0.3 → 10.200.0.3   TCP 158 [TCP Retransmission] 35547 → 5140 [PSH, ACK] Seq=1170 Ack=1 Win=64256 Len=90 TSval=4092381615 TSecr=1241596255
  162 60.481899900   10.200.0.3 → 10.1.0.3     TCP 68 5140 → 35547 [ACK] Seq=1 Ack=1260 Win=65024 Len=0 TSval=1241596255 TSecr=4092381615
  163 60.481900900   10.200.0.3 → 10.1.0.3     TCP 68 [TCP Dup ACK 162#1] 5140 → 35547 [ACK] Seq=1 Ack=1260 Win=65024 Len=0 TSval=1241596255 TSecr=4092381615
  164 60.481909700     10.1.0.3 → 10.200.0.3   TCP 157 35547 → 5140 [PSH, ACK] Seq=1260 Ack=1 Win=64256 Len=89 TSval=4092381615 TSecr=1241596255
  165 60.481911000     10.1.0.3 → 10.200.0.3   TCP 157 [TCP Retransmission] 35547 → 5140 [PSH, ACK] Seq=1260 Ack=1 Win=64256 Len=89 TSval=4092381615 TSecr=1241596255
  166 60.481916400   10.200.0.3 → 10.1.0.3     TCP 68 5140 → 35547 [ACK] Seq=1 Ack=1349 Win=65024 Len=0 TSval=1241596255 TSecr=4092381615
  167 60.481917500   10.200.0.3 → 10.1.0.3     TCP 68 [TCP Dup ACK 166#1] 5140 → 35547 [ACK] Seq=1 Ack=1349 Win=65024 Len=0 TSval=1241596255 TSecr=4092381615
  168 60.481926400     10.1.0.3 → 10.200.0.3   TCP 160 35547 → 5140 [PSH, ACK] Seq=1349 Ack=1 Win=64256 Len=92 TSval=4092381615 TSecr=1241596255
  169 60.481927700     10.1.0.3 → 10.200.0.3   TCP 160 [TCP Retransmission] 35547 → 5140 [PSH, ACK] Seq=1349 Ack=1 Win=64256 Len=92 TSval=4092381615 TSecr=1241596255
  170 60.481932900   10.200.0.3 → 10.1.0.3     TCP 68 5140 → 35547 [ACK] Seq=1 Ack=1441 Win=65024 Len=0 TSval=1241596255 TSecr=4092381615
  171 60.481934000   10.200.0.3 → 10.1.0.3     TCP 68 [TCP Dup ACK 170#1] 5140 → 35547 [ACK] Seq=1 Ack=1441 Win=65024 Len=0 TSval=1241596255 TSecr=4092381615
  172 60.481942700     10.1.0.3 → 10.200.0.3   TCP 162 35547 → 5140 [PSH, ACK] Seq=1441 Ack=1 Win=64256 Len=94 TSval=4092381615 TSecr=1241596255
  173 60.481944000     10.1.0.3 → 10.200.0.3   TCP 162 [TCP Retransmission] 35547 → 5140 [PSH, ACK] Seq=1441 Ack=1 Win=64256 Len=94 TSval=4092381615 TSecr=1241596255
  174 60.481949300   10.200.0.3 → 10.1.0.3     TCP 68 5140 → 35547 [ACK] Seq=1 Ack=1535 Win=65024 Len=0 TSval=1241596255 TSecr=4092381615
  175 60.481950400   10.200.0.3 → 10.1.0.3     TCP 68 [TCP Dup ACK 174#1] 5140 → 35547 [ACK] Seq=1 Ack=1535 Win=65024 Len=0 TSval=1241596255 TSecr=4092381615
  176 60.481958800     10.1.0.3 → 10.200.0.3   TCP 161 35547 → 5140 [PSH, ACK] Seq=1535 Ack=1 Win=64256 Len=93 TSval=4092381615 TSecr=1241596255
  177 60.481960100     10.1.0.3 → 10.200.0.3   TCP 161 [TCP Retransmission] 35547 → 5140 [PSH, ACK] Seq=1535 Ack=1 Win=64256 Len=93 TSval=4092381615 TSecr=1241596255
  178 60.482999700   10.200.0.3 → 10.1.0.3     TCP 68 5140 → 35547 [ACK] Seq=1 Ack=1628 Win=65024 Len=0 TSval=1241596256 TSecr=4092381615
  179 60.483006100   10.200.0.3 → 10.1.0.3     TCP 68 [TCP Dup ACK 178#1] 5140 → 35547 [ACK] Seq=1 Ack=1628 Win=65024 Len=0 TSval=1241596256 TSecr=4092381615
  180 60.483020600     10.1.0.3 → 10.200.0.3   TCP 687 35547 → 5140 [PSH, ACK] Seq=1628 Ack=1 Win=64256 Len=619 TSval=4092381616 TSecr=1241596256
  181 60.483023200     10.1.0.3 → 10.200.0.3   TCP 687 [TCP Retransmission] 35547 → 5140 [PSH, ACK] Seq=1628 Ack=1 Win=64256 Len=619 TSval=4092381616 TSecr=1241596256
  182 60.530799400   10.200.0.3 → 10.1.0.3     TCP 68 5140 → 35547 [ACK] Seq=1 Ack=2247 Win=64512 Len=0 TSval=1241596304 TSecr=4092381616
  183 60.530811900   10.200.0.3 → 10.1.0.3     TCP 68 [TCP Dup ACK 182#1] 5140 → 35547 [ACK] Seq=1 Ack=2247 Win=64512 Len=0 TSval=1241596304 TSecr=4092381616
  184 66.830581300   10.100.0.2 → 224.0.0.5    OSPF 80 Hello Packet
  185 66.830600100   10.100.0.2 → 224.0.0.5    OSPF 80 Hello Packet
  186 66.831278500   10.200.0.2 → 224.0.0.5    OSPF 80 Hello Packet
  187 66.831284100   10.200.0.2 → 224.0.0.5    OSPF 80 Hello Packet
  188 66.831697300     10.1.0.2 → 224.0.0.5    OSPF 84 Hello Packet
  189 66.831702000     10.1.0.2 → 224.0.0.5    OSPF 84 Hello Packet
  190 66.941185400     10.1.0.3 → 224.0.0.5    OSPF 84 Hello Packet
  191 76.830847600   10.100.0.2 → 224.0.0.5    OSPF 80 Hello Packet
  192 76.830866800   10.100.0.2 → 224.0.0.5    OSPF 80 Hello Packet
  193 76.831282500   10.200.0.2 → 224.0.0.5    OSPF 80 Hello Packet
  194 76.831288200   10.200.0.2 → 224.0.0.5    OSPF 80 Hello Packet
  195 76.831701400     10.1.0.2 → 224.0.0.5    OSPF 84 Hello Packet
  196 76.831706500     10.1.0.2 → 224.0.0.5    OSPF 84 Hello Packet
  197 76.941217600     10.1.0.3 → 224.0.0.5    OSPF 84 Hello Packet
  198 86.831252900   10.100.0.2 → 224.0.0.5    OSPF 80 Hello Packet
  199 86.831276500   10.100.0.2 → 224.0.0.5    OSPF 80 Hello Packet
  200 86.831401500   10.200.0.2 → 224.0.0.5    OSPF 80 Hello Packet
  201 86.831407400   10.200.0.2 → 224.0.0.5    OSPF 80 Hello Packet
  202 86.831820200     10.1.0.2 → 224.0.0.5    OSPF 84 Hello Packet
  203 86.831825600     10.1.0.2 → 224.0.0.5    OSPF 84 Hello Packet
  204 86.941348600     10.1.0.3 → 224.0.0.5    OSPF 84 Hello Packet
  205 96.831253400   10.100.0.2 → 224.0.0.5    OSPF 80 Hello Packet
  206 96.831272100   10.100.0.2 → 224.0.0.5    OSPF 80 Hello Packet
  207 96.831405400   10.200.0.2 → 224.0.0.5    OSPF 80 Hello Packet
  208 96.831411100   10.200.0.2 → 224.0.0.5    OSPF 80 Hello Packet
  209 96.831825500     10.1.0.2 → 224.0.0.5    OSPF 84 Hello Packet
  210 96.831830600     10.1.0.2 → 224.0.0.5    OSPF 84 Hello Packet
  211 96.941491500     10.1.0.3 → 224.0.0.5    OSPF 84 Hello Packet
  212 103.151151100   10.200.0.2 → 10.200.0.3   TCP 140 36335 → 5140 [PSH, ACK] Seq=183 Ack=1 Win=502 Len=72 TSval=2381186781 TSecr=1028009854
  213 103.151171300     10.1.0.3 → 10.200.0.3   TCP 140 35547 → 5140 [PSH, ACK] Seq=2247 Ack=1 Win=64256 Len=72 TSval=4092424284 TSecr=1241596304
  214 103.151181700     10.1.0.3 → 10.200.0.3   TCP 140 [TCP Retransmission] 35547 → 5140 [PSH, ACK] Seq=2247 Ack=1 Win=64256 Len=72 TSval=4092424284 TSecr=1241596304
  215 103.151215300   10.200.0.3 → 10.1.0.3     TCP 68 5140 → 35547 [ACK] Seq=1 Ack=2319 Win=64512 Len=0 TSval=1241638924 TSecr=4092424284
  216 103.151217700   10.200.0.3 → 10.200.0.2   TCP 68 5140 → 36335 [ACK] Seq=1 Ack=255 Win=503 Len=0 TSval=1028070864 TSecr=2381186781
  217 103.151221200   10.200.0.3 → 10.1.0.3     TCP 68 [TCP Dup ACK 215#1] 5140 → 35547 [ACK] Seq=1 Ack=2319 Win=64512 Len=0 TSval=1241638924 TSecr=4092424284
  218 106.831322400   10.100.0.2 → 224.0.0.5    OSPF 80 Hello Packet
  219 106.831344600   10.100.0.2 → 224.0.0.5    OSPF 80 Hello Packet
  220 106.831409600   10.200.0.2 → 224.0.0.5    OSPF 80 Hello Packet
  221 106.831415800   10.200.0.2 → 224.0.0.5    OSPF 80 Hello Packet
  222 106.831830200     10.1.0.2 → 224.0.0.5    OSPF 84 Hello Packet
  223 106.831835700     10.1.0.2 → 224.0.0.5    OSPF 84 Hello Packet
  224 106.941521600     10.1.0.3 → 224.0.0.5    OSPF 84 Hello Packet
  225 108.161003400 02:42:0a:01:00:02 →              ARP 44 Who has 10.1.0.3? Tell 10.1.0.2
  226 108.161016800 02:42:0a:c8:00:02 →              ARP 44 Who has 10.200.0.3? Tell 10.200.0.2
  227 108.161081900 02:42:0a:c8:00:03 →              ARP 44 Who has 10.200.0.2? Tell 10.200.0.3
  228 108.161092900 02:42:0a:c8:00:02 →              ARP 44 10.200.0.2 is at 02:42:0a:c8:00:02
  229 108.161101300 02:42:0a:c8:00:03 →              ARP 44 10.200.0.3 is at 02:42:0a:c8:00:03
  230 108.161148500 02:42:0a:01:00:03 →              ARP 44 Who has 10.1.0.2? Tell 10.1.0.3
  231 108.161162000 02:42:0a:01:00:02 →              ARP 44 10.1.0.2 is at 02:42:0a:01:00:02
  232 108.161164300 02:42:0a:01:00:03 →              ARP 44 10.1.0.3 is at 02:42:0a:01:00:03
  233 112.960926800 fe80::7046:95ff:feb4:ad15 → ff02::2      ICMPv6 72 Router Solicitation from 72:46:95:b4:ad:15
  234 116.831353100   10.100.0.2 → 224.0.0.5    OSPF 80 Hello Packet
  235 116.831371700   10.100.0.2 → 224.0.0.5    OSPF 80 Hello Packet
  236 116.831404400   10.200.0.2 → 224.0.0.5    OSPF 80 Hello Packet
  237 116.831409800   10.200.0.2 → 224.0.0.5    OSPF 80 Hello Packet
  238 116.831820300     10.1.0.2 → 224.0.0.5    OSPF 84 Hello Packet
  239 116.831825300     10.1.0.2 → 224.0.0.5    OSPF 84 Hello Packet
  240 116.941643800     10.1.0.3 → 224.0.0.5    OSPF 84 Hello Packet
  241 123.200633300 fe80::9011:5bff:fe43:a202 → ff02::2      ICMPv6 72 Router Solicitation from 92:11:5b:43:a2:02
  242 123.200701300 fe80::70ba:f5ff:fe50:e7a2 → ff02::2      ICMPv6 72 Router Solicitation from 72:ba:f5:50:e7:a2
  243 126.831578300   10.100.0.2 → 224.0.0.5    OSPF 80 Hello Packet
  244 126.831599600   10.100.0.2 → 224.0.0.5    OSPF 80 Hello Packet
  245 126.831622300   10.200.0.2 → 224.0.0.5    OSPF 80 Hello Packet
  246 126.831628800   10.200.0.2 → 224.0.0.5    OSPF 80 Hello Packet
  247 126.831836600     10.1.0.2 → 224.0.0.5    OSPF 84 Hello Packet
  248 126.831844500     10.1.0.2 → 224.0.0.5    OSPF 84 Hello Packet
  249 126.941728000     10.1.0.3 → 224.0.0.5    OSPF 84 Hello Packet
  250 136.831591500   10.100.0.2 → 224.0.0.5    OSPF 80 Hello Packet
  251 136.831613500   10.100.0.2 → 224.0.0.5    OSPF 80 Hello Packet
  252 136.831632600   10.200.0.2 → 224.0.0.5    OSPF 80 Hello Packet
  253 136.831638000   10.200.0.2 → 224.0.0.5    OSPF 80 Hello Packet
  254 136.831834400     10.1.0.2 → 224.0.0.5    OSPF 84 Hello Packet
  255 136.831839700     10.1.0.2 → 224.0.0.5    OSPF 84 Hello Packet
  256 136.941748100     10.1.0.3 → 224.0.0.5    OSPF 84 Hello Packet
  257 146.831553300   10.100.0.2 → 224.0.0.5    OSPF 80 Hello Packet
  258 146.831573900   10.100.0.2 → 224.0.0.5    OSPF 80 Hello Packet
  259 146.831592100   10.200.0.2 → 224.0.0.5    OSPF 80 Hello Packet
  260 146.831597200   10.200.0.2 → 224.0.0.5    OSPF 80 Hello Packet
  261 146.831789800     10.1.0.2 → 224.0.0.5    OSPF 84 Hello Packet
  262 146.831795900     10.1.0.2 → 224.0.0.5    OSPF 84 Hello Packet
  263 146.941706300     10.1.0.3 → 224.0.0.5    OSPF 84 Hello Packet
  264 156.832125200   10.100.0.2 → 224.0.0.5    OSPF 80 Hello Packet
  265 156.832147400   10.100.0.2 → 224.0.0.5    OSPF 80 Hello Packet
  266 156.832166300   10.200.0.2 → 224.0.0.5    OSPF 80 Hello Packet
  267 156.832171800   10.200.0.2 → 224.0.0.5    OSPF 80 Hello Packet
  268 156.832185300     10.1.0.2 → 224.0.0.5    OSPF 84 Hello Packet
  269 156.832190100     10.1.0.2 → 224.0.0.5    OSPF 84 Hello Packet
  270 156.942070700     10.1.0.3 → 224.0.0.5    OSPF 84 Hello Packet
  271 164.171216200     10.1.0.3 → 10.200.0.3   TCP 140 35547 → 5140 [PSH, ACK] Seq=2319 Ack=1 Win=64256 Len=72 TSval=4092485304 TSecr=1241638924
  272 164.171230400     10.1.0.3 → 10.200.0.3   TCP 140 [TCP Retransmission] 35547 → 5140 [PSH, ACK] Seq=2319 Ack=1 Win=64256 Len=72 TSval=4092485304 TSecr=1241638924
  273 164.171293800   10.200.0.3 → 10.1.0.3     TCP 68 5140 → 35547 [ACK] Seq=1 Ack=2391 Win=64512 Len=0 TSval=1241699944 TSecr=4092485304
  274 164.171299700   10.200.0.3 → 10.1.0.3     TCP 68 [TCP Dup ACK 273#1] 5140 → 35547 [ACK] Seq=1 Ack=2391 Win=64512 Len=0 TSval=1241699944 TSecr=4092485304
  275 164.171337200   10.200.0.2 → 10.200.0.3   TCP 140 36335 → 5140 [PSH, ACK] Seq=255 Ack=1 Win=502 Len=72 TSval=2381247801 TSecr=1028070864
  276 164.171371100   10.200.0.3 → 10.200.0.2   TCP 68 5140 → 36335 [ACK] Seq=1 Ack=327 Win=503 Len=0 TSval=1028131884 TSecr=2381247801
  277 166.832130500   10.100.0.2 → 224.0.0.5    OSPF 80 Hello Packet
  278 166.832149500   10.100.0.2 → 224.0.0.5    OSPF 80 Hello Packet
  279 166.832167300   10.200.0.2 → 224.0.0.5    OSPF 80 Hello Packet
  280 166.832172300   10.200.0.2 → 224.0.0.5    OSPF 80 Hello Packet
  281 166.832184700     10.1.0.2 → 224.0.0.5    OSPF 84 Hello Packet
  282 166.832189200     10.1.0.2 → 224.0.0.5    OSPF 84 Hello Packet
  283 166.942089500     10.1.0.3 → 224.0.0.5    OSPF 84 Hello Packet
  284 169.200387700 02:42:0a:01:00:02 →              ARP 44 Who has 10.1.0.3? Tell 10.1.0.2
  285 169.200451800 02:42:0a:c8:00:02 →              ARP 44 Who has 10.200.0.3? Tell 10.200.0.2
  286 169.200519200 02:42:0a:c8:00:03 →              ARP 44 Who has 10.200.0.2? Tell 10.200.0.3
  287 169.200531100 02:42:0a:c8:00:02 →              ARP 44 10.200.0.2 is at 02:42:0a:c8:00:02
  288 169.200521700 02:42:0a:01:00:03 →              ARP 44 Who has 10.1.0.2? Tell 10.1.0.3
  289 169.200535700 02:42:0a:01:00:02 →              ARP 44 10.1.0.2 is at 02:42:0a:01:00:02
  290 169.200537000 02:42:0a:01:00:03 →              ARP 44 10.1.0.3 is at 02:42:0a:01:00:03
  291 169.200538300 02:42:0a:c8:00:03 →              ARP 44 10.200.0.3 is at 02:42:0a:c8:00:03
  292 176.832257700   10.100.0.2 → 224.0.0.5    OSPF 80 Hello Packet
  293 176.832279200   10.100.0.2 → 224.0.0.5    OSPF 80 Hello Packet
  294 176.832297400   10.200.0.2 → 224.0.0.5    OSPF 80 Hello Packet
  295 176.832302900   10.200.0.2 → 224.0.0.5    OSPF 80 Hello Packet
  296 176.832316100     10.1.0.2 → 224.0.0.5    OSPF 84 Hello Packet
  297 176.832320700     10.1.0.2 → 224.0.0.5    OSPF 84 Hello Packet
  298 176.942222100     10.1.0.3 → 224.0.0.5    OSPF 84 Hello Packet
  299 186.832271700   10.100.0.2 → 224.0.0.5    OSPF 80 Hello Packet
  300 186.832293400   10.100.0.2 → 224.0.0.5    OSPF 80 Hello Packet
  301 186.832312500   10.200.0.2 → 224.0.0.5    OSPF 80 Hello Packet
  302 186.832317900   10.200.0.2 → 224.0.0.5    OSPF 80 Hello Packet
  303 186.832331600     10.1.0.2 → 224.0.0.5    OSPF 84 Hello Packet
  304 186.832336300     10.1.0.2 → 224.0.0.5    OSPF 84 Hello Packet
  305 186.942242000     10.1.0.3 → 224.0.0.5    OSPF 84 Hello Packet
  306 188.334238100     10.2.0.3 → 10.200.0.3   TCP 76 36781 → 5140 [SYN] Seq=0 Win=64240 Len=0 MSS=1460 SACK_PERM=1 TSval=649564195 TSecr=0 WS=128
  307 188.334269500     10.2.0.3 → 10.200.0.3   TCP 76 [TCP Out-Of-Order] [TCP Port numbers reused] 36781 → 5140 [SYN] Seq=0 Win=64240 Len=0 MSS=1460 SACK_PERM=1 TSval=649564195 TSecr=0 WS=128
  308 188.334298300   10.200.0.3 → 10.2.0.3     TCP 76 5140 → 36781 [SYN, ACK] Seq=0 Ack=1 Win=65160 Len=0 MSS=1460 SACK_PERM=1 TSval=1273024664 TSecr=649564195 WS=128
  309 188.334301700   10.200.0.3 → 10.2.0.3     TCP 76 [TCP Out-Of-Order] 5140 → 36781 [SYN, ACK] Seq=0 Ack=1 Win=65160 Len=0 MSS=1460 SACK_PERM=1 TSval=1273024664 TSecr=649564195 WS=128
  310 188.334330300     10.2.0.3 → 10.200.0.3   TCP 68 36781 → 5140 [ACK] Seq=1 Ack=1 Win=64256 Len=0 TSval=649564195 TSecr=1273024664
  311 188.334331900     10.2.0.3 → 10.200.0.3   TCP 68 [TCP Dup ACK 310#1] 36781 → 5140 [ACK] Seq=1 Ack=1 Win=64256 Len=0 TSval=649564195 TSecr=1273024664
  312 188.334799200     10.2.0.3 → 10.200.0.3   TCP 151 36781 → 5140 [PSH, ACK] Seq=1 Ack=1 Win=64256 Len=83 TSval=649564195 TSecr=1273024664
  313 188.334808500     10.2.0.3 → 10.200.0.3   TCP 151 [TCP Retransmission] 36781 → 5140 [PSH, ACK] Seq=1 Ack=1 Win=64256 Len=83 TSval=649564195 TSecr=1273024664
  314 188.334876500   10.200.0.3 → 10.2.0.3     TCP 68 5140 → 36781 [ACK] Seq=1 Ack=84 Win=65152 Len=0 TSval=1273024665 TSecr=649564195
  315 188.334882200   10.200.0.3 → 10.2.0.3     TCP 68 [TCP Dup ACK 314#1] 5140 → 36781 [ACK] Seq=1 Ack=84 Win=65152 Len=0 TSval=1273024665 TSecr=649564195
  316 188.334927200     10.2.0.3 → 10.200.0.3   TCP 153 36781 → 5140 [PSH, ACK] Seq=84 Ack=1 Win=64256 Len=85 TSval=649564196 TSecr=1273024665
  317 188.334929400     10.2.0.3 → 10.200.0.3   TCP 153 [TCP Retransmission] 36781 → 5140 [PSH, ACK] Seq=84 Ack=1 Win=64256 Len=85 TSval=649564196 TSecr=1273024665
  318 188.334936600   10.200.0.3 → 10.2.0.3     TCP 68 5140 → 36781 [ACK] Seq=1 Ack=169 Win=65152 Len=0 TSval=1273024665 TSecr=649564196
  319 188.334937700   10.200.0.3 → 10.2.0.3     TCP 68 [TCP Dup ACK 318#1] 5140 → 36781 [ACK] Seq=1 Ack=169 Win=65152 Len=0 TSval=1273024665 TSecr=649564196
  320 188.334955100     10.2.0.3 → 10.200.0.3   TCP 180 36781 → 5140 [PSH, ACK] Seq=169 Ack=1 Win=64256 Len=112 TSval=649564196 TSecr=1273024665
  321 188.334956400     10.2.0.3 → 10.200.0.3   TCP 180 [TCP Retransmission] 36781 → 5140 [PSH, ACK] Seq=169 Ack=1 Win=64256 Len=112 TSval=649564196 TSecr=1273024665
  322 188.334962800   10.200.0.3 → 10.2.0.3     TCP 68 5140 → 36781 [ACK] Seq=1 Ack=281 Win=65152 Len=0 TSval=1273024665 TSecr=649564196
  323 188.334964000   10.200.0.3 → 10.2.0.3     TCP 68 [TCP Dup ACK 322#1] 5140 → 36781 [ACK] Seq=1 Ack=281 Win=65152 Len=0 TSval=1273024665 TSecr=649564196
  324 188.334979700     10.2.0.3 → 10.200.0.3   TCP 179 36781 → 5140 [PSH, ACK] Seq=281 Ack=1 Win=64256 Len=111 TSval=649564196 TSecr=1273024665
  325 188.334980800     10.2.0.3 → 10.200.0.3   TCP 179 [TCP Retransmission] 36781 → 5140 [PSH, ACK] Seq=281 Ack=1 Win=64256 Len=111 TSval=649564196 TSecr=1273024665
  326 188.334986400   10.200.0.3 → 10.2.0.3     TCP 68 5140 → 36781 [ACK] Seq=1 Ack=392 Win=65152 Len=0 TSval=1273024665 TSecr=649564196
  327 188.334987400   10.200.0.3 → 10.2.0.3     TCP 68 [TCP Dup ACK 326#1] 5140 → 36781 [ACK] Seq=1 Ack=392 Win=65152 Len=0 TSval=1273024665 TSecr=649564196
  328 188.335003200     10.2.0.3 → 10.200.0.3   TCP 180 36781 → 5140 [PSH, ACK] Seq=392 Ack=1 Win=64256 Len=112 TSval=649564196 TSecr=1273024665
  329 188.335004300     10.2.0.3 → 10.200.0.3   TCP 180 [TCP Retransmission] 36781 → 5140 [PSH, ACK] Seq=392 Ack=1 Win=64256 Len=112 TSval=649564196 TSecr=1273024665
  330 188.335009800   10.200.0.3 → 10.2.0.3     TCP 68 5140 → 36781 [ACK] Seq=1 Ack=504 Win=65152 Len=0 TSval=1273024665 TSecr=649564196
  331 188.335010900   10.200.0.3 → 10.2.0.3     TCP 68 [TCP Dup ACK 330#1] 5140 → 36781 [ACK] Seq=1 Ack=504 Win=65152 Len=0 TSval=1273024665 TSecr=649564196
  332 188.335026100     10.2.0.3 → 10.200.0.3   TCP 182 36781 → 5140 [PSH, ACK] Seq=504 Ack=1 Win=64256 Len=114 TSval=649564196 TSecr=1273024665
  333 188.335027200     10.2.0.3 → 10.200.0.3   TCP 182 [TCP Retransmission] 36781 → 5140 [PSH, ACK] Seq=504 Ack=1 Win=64256 Len=114 TSval=649564196 TSecr=1273024665
  334 188.335032700   10.200.0.3 → 10.2.0.3     TCP 68 5140 → 36781 [ACK] Seq=1 Ack=618 Win=65152 Len=0 TSval=1273024665 TSecr=649564196
  335 188.335033800   10.200.0.3 → 10.2.0.3     TCP 68 [TCP Dup ACK 334#1] 5140 → 36781 [ACK] Seq=1 Ack=618 Win=65152 Len=0 TSval=1273024665 TSecr=649564196
  336 188.335049600     10.2.0.3 → 10.200.0.3   TCP 197 36781 → 5140 [PSH, ACK] Seq=618 Ack=1 Win=64256 Len=129 TSval=649564196 TSecr=1273024665
  337 188.335050700     10.2.0.3 → 10.200.0.3   TCP 197 [TCP Retransmission] 36781 → 5140 [PSH, ACK] Seq=618 Ack=1 Win=64256 Len=129 TSval=649564196 TSecr=1273024665
  338 188.335056400   10.200.0.3 → 10.2.0.3     TCP 68 5140 → 36781 [ACK] Seq=1 Ack=747 Win=65024 Len=0 TSval=1273024665 TSecr=649564196
  339 188.335057400   10.200.0.3 → 10.2.0.3     TCP 68 [TCP Dup ACK 338#1] 5140 → 36781 [ACK] Seq=1 Ack=747 Win=65024 Len=0 TSval=1273024665 TSecr=649564196
  340 188.335072500     10.2.0.3 → 10.200.0.3   TCP 151 36781 → 5140 [PSH, ACK] Seq=747 Ack=1 Win=64256 Len=83 TSval=649564196 TSecr=1273024665
  341 188.335073600     10.2.0.3 → 10.200.0.3   TCP 151 [TCP Retransmission] 36781 → 5140 [PSH, ACK] Seq=747 Ack=1 Win=64256 Len=83 TSval=649564196 TSecr=1273024665
  342 188.335079100   10.200.0.3 → 10.2.0.3     TCP 68 5140 → 36781 [ACK] Seq=1 Ack=830 Win=65024 Len=0 TSval=1273024665 TSecr=649564196
  343 188.335080200   10.200.0.3 → 10.2.0.3     TCP 68 [TCP Dup ACK 342#1] 5140 → 36781 [ACK] Seq=1 Ack=830 Win=65024 Len=0 TSval=1273024665 TSecr=649564196
  344 188.335095500     10.2.0.3 → 10.200.0.3   TCP 153 36781 → 5140 [PSH, ACK] Seq=830 Ack=1 Win=64256 Len=85 TSval=649564196 TSecr=1273024665
  345 188.335096600     10.2.0.3 → 10.200.0.3   TCP 153 [TCP Retransmission] 36781 → 5140 [PSH, ACK] Seq=830 Ack=1 Win=64256 Len=85 TSval=649564196 TSecr=1273024665
  346 188.335102000   10.200.0.3 → 10.2.0.3     TCP 68 5140 → 36781 [ACK] Seq=1 Ack=915 Win=65024 Len=0 TSval=1273024665 TSecr=649564196
  347 188.335103400   10.200.0.3 → 10.2.0.3     TCP 68 [TCP Dup ACK 346#1] 5140 → 36781 [ACK] Seq=1 Ack=915 Win=65024 Len=0 TSval=1273024665 TSecr=649564196
  348 188.335103300     10.3.0.3 → 10.200.0.3   TCP 76 36109 → 5140 [SYN] Seq=0 Win=64240 Len=0 MSS=1460 SACK_PERM=1 TSval=541470739 TSecr=0 WS=128
  349 188.335111000     10.3.0.3 → 10.200.0.3   TCP 76 [TCP Out-Of-Order] [TCP Port numbers reused] 36109 → 5140 [SYN] Seq=0 Win=64240 Len=0 MSS=1460 SACK_PERM=1 TSval=541470739 TSecr=0 WS=128
  350 188.335119000     10.2.0.3 → 10.200.0.3   TCP 150 36781 → 5140 [PSH, ACK] Seq=915 Ack=1 Win=64256 Len=82 TSval=649564196 TSecr=1273024665
  351 188.335120200     10.2.0.3 → 10.200.0.3   TCP 150 [TCP Retransmission] 36781 → 5140 [PSH, ACK] Seq=915 Ack=1 Win=64256 Len=82 TSval=649564196 TSecr=1273024665
  352 188.335125600   10.200.0.3 → 10.2.0.3     TCP 68 5140 → 36781 [ACK] Seq=1 Ack=997 Win=65024 Len=0 TSval=1273024665 TSecr=649564196
  353 188.335126700   10.200.0.3 → 10.2.0.3     TCP 68 [TCP Dup ACK 352#1] 5140 → 36781 [ACK] Seq=1 Ack=997 Win=65024 Len=0 TSval=1273024665 TSecr=649564196
  354 188.335129000   10.200.0.3 → 10.3.0.3     TCP 76 5140 → 36109 [SYN, ACK] Seq=0 Ack=1 Win=65160 Len=0 MSS=1460 SACK_PERM=1 TSval=1869399138 TSecr=541470739 WS=128
  355 188.335131200   10.200.0.3 → 10.3.0.3     TCP 76 [TCP Out-Of-Order] 5140 → 36109 [SYN, ACK] Seq=0 Ack=1 Win=65160 Len=0 MSS=1460 SACK_PERM=1 TSval=1869399138 TSecr=541470739 WS=128
  356 188.335141800     10.2.0.3 → 10.200.0.3   TCP 151 36781 → 5140 [PSH, ACK] Seq=997 Ack=1 Win=64256 Len=83 TSval=649564196 TSecr=1273024665
  357 188.335143000     10.2.0.3 → 10.200.0.3   TCP 151 [TCP Retransmission] 36781 → 5140 [PSH, ACK] Seq=997 Ack=1 Win=64256 Len=83 TSval=649564196 TSecr=1273024665
  358 188.335148500   10.200.0.3 → 10.2.0.3     TCP 68 5140 → 36781 [ACK] Seq=1 Ack=1080 Win=65024 Len=0 TSval=1273024665 TSecr=649564196
  359 188.335149500   10.200.0.3 → 10.2.0.3     TCP 68 [TCP Dup ACK 358#1] 5140 → 36781 [ACK] Seq=1 Ack=1080 Win=65024 Len=0 TSval=1273024665 TSecr=649564196
  360 188.335155500     10.3.0.3 → 10.200.0.3   TCP 68 36109 → 5140 [ACK] Seq=1 Ack=1 Win=64256 Len=0 TSval=541470739 TSecr=1869399138
  361 188.335156900     10.3.0.3 → 10.200.0.3   TCP 68 [TCP Dup ACK 360#1] 36109 → 5140 [ACK] Seq=1 Ack=1 Win=64256 Len=0 TSval=541470739 TSecr=1869399138
  362 188.335165800     10.2.0.3 → 10.200.0.3   TCP 158 36781 → 5140 [PSH, ACK] Seq=1080 Ack=1 Win=64256 Len=90 TSval=649564196 TSecr=1273024665
  363 188.335167000     10.2.0.3 → 10.200.0.3   TCP 158 [TCP Retransmission] 36781 → 5140 [PSH, ACK] Seq=1080 Ack=1 Win=64256 Len=90 TSval=649564196 TSecr=1273024665
  364 188.335172600   10.200.0.3 → 10.2.0.3     TCP 68 5140 → 36781 [ACK] Seq=1 Ack=1170 Win=65024 Len=0 TSval=1273024665 TSecr=649564196
  365 188.335173700   10.200.0.3 → 10.2.0.3     TCP 68 [TCP Dup ACK 364#1] 5140 → 36781 [ACK] Seq=1 Ack=1170 Win=65024 Len=0 TSval=1273024665 TSecr=649564196
  366 188.335189300     10.2.0.3 → 10.200.0.3   TCP 158 36781 → 5140 [PSH, ACK] Seq=1170 Ack=1 Win=64256 Len=90 TSval=649564196 TSecr=1273024665
  367 188.335190400     10.2.0.3 → 10.200.0.3   TCP 158 [TCP Retransmission] 36781 → 5140 [PSH, ACK] Seq=1170 Ack=1 Win=64256 Len=90 TSval=649564196 TSecr=1273024665
