    1 0.000000000 fe80::e883:46ff:fe1b:27e3 → ff02::16     ICMPv6 92 Multicast Listener Report Message v2
    2 0.480017100     10.1.0.3 → 10.200.0.3   TCP 76 35547 → 5140 [SYN] Seq=0 Win=64240 Len=0 MSS=1460 SACK_PERM=1 TSval=4092319773 TSecr=0 WS=128
    3 2.560287400 fe80::b007:e5ff:fe5d:12a0 → ff02::2      ICMPv6 72 Router Solicitation from b2:07:e5:5d:12:a0
    4 3.120060900 fe80::a465:b1ff:fea7:8609 → ff02::2      ICMPv6 72 Router Solicitation from a6:65:b1:a7:86:09
    5 3.280256400 fe80::e883:46ff:fe1b:27e3 → ff02::2      ICMPv6 72 Router Solicitation from ea:83:46:1b:27:e3
    6 4.560508000     10.1.0.3 → 10.200.0.3   TCP 76 [TCP Retransmission] [TCP Port numbers reused] 35547 → 5140 [SYN] Seq=0 Win=64240 Len=0 MSS=1460 SACK_PERM=1 TSval=4092323854 TSecr=0 WS=128
    7 8.671351200     10.1.0.2 → 224.0.0.5    OSPF 84 Hello Packet
    8 8.676100400     10.3.0.3 → 224.0.0.5    OSPF 84 Hello Packet
    9 8.780571500     10.1.0.3 → 224.0.0.5    OSPF 84 Hello Packet
   10 8.780590300     10.1.0.3 → 224.0.0.5    OSPF 84 Hello Packet
   11 8.781158800     10.2.0.2 → 224.0.0.5    OSPF 84 Hello Packet
   12 8.781172500     10.2.0.2 → 224.0.0.5    OSPF 84 Hello Packet
   13 8.782145400     10.3.0.2 → 224.0.0.5    OSPF 84 Hello Packet
   14 8.782151500     10.3.0.2 → 224.0.0.5    OSPF 84 Hello Packet
   15 8.807552600     10.2.0.3 → 224.0.0.5    OSPF 84 Hello Packet
   16 11.120277400 fe80::b007:e5ff:fe5d:12a0 → ff02::2      ICMPv6 72 Router Solicitation from b2:07:e5:5d:12:a0
   17 11.760096800 fe80::e883:46ff:fe1b:27e3 → ff02::2      ICMPv6 72 Router Solicitation from ea:83:46:1b:27:e3
   18 11.760096800 fe80::a465:b1ff:fea7:8609 → ff02::2      ICMPv6 72 Router Solicitation from a6:65:b1:a7:86:09
   19 13.040378100     10.1.0.3 → 10.200.0.3   TCP 76 [TCP Retransmission] [TCP Port numbers reused] 35547 → 5140 [SYN] Seq=0 Win=64240 Len=0 MSS=1460 SACK_PERM=1 TSval=4092332334 TSecr=0 WS=128
   20 13.680310400 02:42:0a:03:00:02 →              ARP 44 Who has 10.3.0.3? Tell 10.3.0.2
   21 13.680356300 02:42:0a:01:00:03 →              ARP 44 Who has 10.1.0.2? Tell 10.1.0.3
   22 13.680400800 02:42:0a:03:00:03 →              ARP 44 10.3.0.3 is at 02:42:0a:03:00:03
   23 13.680402000 02:42:0a:01:00:02 →              ARP 44 10.1.0.2 is at 02:42:0a:01:00:02
   24 13.840394900 02:42:0a:02:00:03 →              ARP 44 Who has 10.2.0.2? Tell 10.2.0.3
   25 13.840403700 02:42:0a:02:00:02 →              ARP 44 10.2.0.2 is at 02:42:0a:02:00:02
   26 18.671385600     10.1.0.2 → 224.0.0.5    OSPF 84 Hello Packet
   27 18.676101300     10.3.0.3 → 224.0.0.5    OSPF 84 Hello Packet
   28 18.780595700     10.1.0.3 → 224.0.0.5    OSPF 84 Hello Packet
   29 18.780615400     10.1.0.3 → 224.0.0.5    OSPF 84 Hello Packet
   30 18.781162300     10.2.0.2 → 224.0.0.5    OSPF 84 Hello Packet
   31 18.781173000     10.2.0.2 → 224.0.0.5    OSPF 84 Hello Packet
   32 18.782153900     10.3.0.2 → 224.0.0.5    OSPF 84 Hello Packet
   33 18.782162100     10.3.0.2 → 224.0.0.5    OSPF 84 Hello Packet
   34 18.807720400     10.2.0.3 → 224.0.0.5    OSPF 84 Hello Packet
   35 23.840388600 02:42:0a:02:00:02 →              ARP 44 Who has 10.2.0.3? Tell 10.2.0.2
   36 23.840467900 02:42:0a:02:00:03 →              ARP 44 10.2.0.3 is at 02:42:0a:02:00:03
   37 24.480709700 02:42:0a:03:00:03 →              ARP 44 Who has 10.3.0.2? Tell 10.3.0.3
   38 24.480717700 02:42:0a:03:00:02 →              ARP 44 10.3.0.2 is at 02:42:0a:03:00:02
   39 26.400861000 02:42:0a:01:00:02 →              ARP 44 Who has 10.1.0.3? Tell 10.1.0.2
   40 26.400869600 02:42:0a:01:00:03 →              ARP 44 10.1.0.3 is at 02:42:0a:01:00:03
   41 28.401080300 fe80::a465:b1ff:fea7:8609 → ff02::2      ICMPv6 72 Router Solicitation from a6:65:b1:a7:86:09
   42 28.401080300 fe80::e883:46ff:fe1b:27e3 → ff02::2      ICMPv6 72 Router Solicitation from ea:83:46:1b:27:e3
   43 28.401080200 fe80::b007:e5ff:fe5d:12a0 → ff02::2      ICMPv6 72 Router Solicitation from b2:07:e5:5d:12:a0
   44 28.671769400     10.1.0.2 → 224.0.0.5    OSPF 84 Hello Packet
   45 28.676539100     10.3.0.3 → 224.0.0.5    OSPF 84 Hello Packet
   46 28.781021600     10.1.0.3 → 224.0.0.5    OSPF 84 Hello Packet
   47 28.781040400     10.1.0.3 → 224.0.0.5    OSPF 84 Hello Packet
   48 28.781565700     10.2.0.2 → 224.0.0.5    OSPF 84 Hello Packet
   49 28.781577800     10.2.0.2 → 224.0.0.5    OSPF 84 Hello Packet
   50 28.782554300     10.3.0.2 → 224.0.0.5    OSPF 84 Hello Packet
   51 28.782561600     10.3.0.2 → 224.0.0.5    OSPF 84 Hello Packet
   52 28.808129200     10.2.0.3 → 224.0.0.5    OSPF 84 Hello Packet
   53 29.680921600     10.1.0.3 → 10.200.0.3   TCP 76 [TCP Retransmission] [TCP Port numbers reused] 35547 → 5140 [SYN] Seq=0 Win=64240 Len=0 MSS=1460 SACK_PERM=1 TSval=4092348974 TSecr=0 WS=128
   54 34.720394500 02:42:0a:01:00:03 →              ARP 44 Who has 10.1.0.1? Tell 10.1.0.3
   55 34.720466000 02:42:8b:af:fd:e6 →              ARP 44 10.1.0.1 is at 02:42:8b:af:fd:e6
   56 38.670893000     10.1.0.2 → 10.1.0.3     OSPF 68 DB Description
   57 38.671768900     10.1.0.2 → 224.0.0.5    OSPF 84 Hello Packet
   58 38.675561800     10.3.0.3 → 10.3.0.2     OSPF 68 DB Description
   59 38.676504500     10.3.0.3 → 224.0.0.5    OSPF 84 Hello Packet
   60 38.780022500     10.1.0.3 → 10.1.0.2     OSPF 68 DB Description
   61 38.780531100     10.2.0.2 → 10.2.0.3     OSPF 68 DB Description
   62 38.781005700     10.1.0.3 → 224.0.0.5    OSPF 84 Hello Packet
   63 38.781012900     10.1.0.3 → 224.0.0.5    OSPF 84 Hello Packet
   64 38.781593800     10.3.0.2 → 10.3.0.3     OSPF 68 DB Description
   65 38.781632100     10.2.0.2 → 224.0.0.5    OSPF 84 Hello Packet
   66 38.781639000     10.2.0.2 → 224.0.0.5    OSPF 84 Hello Packet
   67 38.782556800     10.3.0.2 → 224.0.0.5    OSPF 84 Hello Packet
   68 38.782561300     10.3.0.2 → 224.0.0.5    OSPF 84 Hello Packet
   69 38.806521500     10.2.0.3 → 10.2.0.2     OSPF 68 DB Description
   70 38.808105800     10.2.0.3 → 224.0.0.5    OSPF 84 Hello Packet
   71 43.671675300     10.1.0.2 → 10.1.0.3     OSPF 68 DB Description
   72 43.671927900     10.1.0.3 → 10.1.0.2     OSPF 88 DB Description
   73 43.672220600     10.1.0.2 → 10.1.0.3     OSPF 88 DB Description
   74 43.672288900     10.1.0.2 → 10.1.0.3     OSPF 72 LS Request
   75 43.672345700     10.1.0.3 → 10.1.0.2     OSPF 68 DB Description
   76 43.672412200     10.1.0.3 → 10.1.0.2     OSPF 72 LS Request
   77 43.672443700     10.1.0.3 → 224.0.0.5    OSPF 124 LS Update
   78 43.672450800     10.1.0.3 → 224.0.0.5    OSPF 124 LS Update
   79 43.672515700     10.1.0.2 → 224.0.0.5    OSPF 124 LS Update
   80 43.672667200     10.1.0.2 → 224.0.0.5    OSPF 156 LS Update
   81 43.672770200     10.1.0.3 → 224.0.0.5    OSPF 124 LS Update
   82 43.672785100     10.1.0.3 → 224.0.0.5    OSPF 124 LS Update
   83 43.676093700     10.3.0.3 → 10.3.0.2     OSPF 68 DB Description
   84 43.676253800     10.3.0.2 → 10.3.0.3     OSPF 128 DB Description
   85 43.676472500     10.3.0.3 → 10.3.0.2     OSPF 88 DB Description
   86 43.676530500     10.3.0.3 → 10.3.0.2     OSPF 96 LS Request
   87 43.676605400     10.3.0.2 → 10.3.0.3     OSPF 68 DB Description
   88 43.676665900     10.3.0.2 → 10.3.0.3     OSPF 72 LS Request
   89 43.676697000     10.3.0.2 → 224.0.0.5    OSPF 216 LS Update
   90 43.676702900     10.3.0.2 → 224.0.0.5    OSPF 216 LS Update
   91 43.676765900     10.3.0.3 → 224.0.0.5    OSPF 124 LS Update
   92 43.676884200     10.1.0.3 → 224.0.0.5    OSPF 124 LS Update
   93 43.676887700     10.3.0.3 → 224.0.0.5    OSPF 156 LS Update
   94 43.676896600     10.1.0.3 → 224.0.0.5    OSPF 124 LS Update
   95 43.676950300     10.3.0.2 → 224.0.0.5    OSPF 124 LS Update
   96 43.676957100     10.3.0.2 → 224.0.0.5    OSPF 124 LS Update
   97 43.677005300     10.1.0.3 → 224.0.0.5    OSPF 124 LS Update
   98 43.677015900     10.1.0.3 → 224.0.0.5    OSPF 124 LS Update
   99 43.677099400     10.1.0.3 → 224.0.0.5    OSPF 96 LS Update
  100 43.677104700     10.1.0.3 → 224.0.0.5    OSPF 96 LS Update
  101 43.678048100     10.3.0.3 → 224.0.0.5    OSPF 120 LS Acknowledge
  102 43.680446900 02:42:0a:01:00:03 →              ARP 44 Who has 10.1.0.2? Tell 10.1.0.3
  103 43.680511400 02:42:0a:01:00:02 →              ARP 44 10.1.0.2 is at 02:42:0a:01:00:02
  104 43.780565800     10.2.0.2 → 10.2.0.3     OSPF 68 DB Description
  105 43.780817600     10.2.0.3 → 10.2.0.2     OSPF 88 DB Description
  106 43.781046900     10.2.0.2 → 10.2.0.3     OSPF 168 DB Description
  107 43.781105900     10.2.0.2 → 10.2.0.3     OSPF 72 LS Request
  108 43.781173300     10.2.0.3 → 10.2.0.2     OSPF 68 DB Description
  109 43.781225100     10.2.0.3 → 10.2.0.2     OSPF 120 LS Request
  110 43.781257500     10.2.0.3 → 224.0.0.5    OSPF 124 LS Update
  111 43.781308900     10.2.0.2 → 224.0.0.5    OSPF 308 LS Update
  112 43.781317100     10.2.0.2 → 224.0.0.5    OSPF 308 LS Update
  113 43.781400200     10.1.0.3 → 224.0.0.5    OSPF 124 LS Update
  114 43.781409100     10.1.0.3 → 224.0.0.5    OSPF 124 LS Update
  115 43.781447300     10.3.0.2 → 224.0.0.5    OSPF 216 LS Update
  116 43.781453200     10.3.0.2 → 224.0.0.5    OSPF 216 LS Update
  117 43.781502900     10.2.0.2 → 224.0.0.5    OSPF 156 LS Update
  118 43.781511900     10.2.0.2 → 224.0.0.5    OSPF 156 LS Update
  119 43.781526800     10.1.0.3 → 224.0.0.5    OSPF 156 LS Update
  120 43.781535000     10.1.0.3 → 224.0.0.5    OSPF 156 LS Update
  121 43.781606800     10.2.0.3 → 224.0.0.5    OSPF 124 LS Update
  122 43.783200000     10.1.0.3 → 224.0.0.5    OSPF 100 LS Acknowledge
  123 43.783216800     10.1.0.3 → 224.0.0.5    OSPF 100 LS Acknowledge
  124 43.783280300     10.2.0.2 → 224.0.0.5    OSPF 80 LS Acknowledge
  125 43.783288400     10.2.0.2 → 224.0.0.5    OSPF 80 LS Acknowledge
  126 43.783333400     10.3.0.2 → 224.0.0.5    OSPF 100 LS Acknowledge
  127 43.783341000     10.3.0.2 → 224.0.0.5    OSPF 100 LS Acknowledge
  128 43.808760500     10.2.0.3 → 224.0.0.5    OSPF 180 LS Acknowledge
  129 44.672821200     10.1.0.2 → 224.0.0.5    OSPF 160 LS Acknowledge
  130 44.678084900     10.3.0.3 → 224.0.0.5    OSPF 100 LS Acknowledge
  131 45.600429200 02:42:0a:02:00:02 →              ARP 44 Who has 10.2.0.3? Tell 10.2.0.2
  132 45.600496200 02:42:0a:02:00:03 →              ARP 44 10.2.0.3 is at 02:42:0a:02:00:03
  133 48.671773000     10.1.0.2 → 224.0.0.5    OSPF 84 Hello Packet
  134 48.676565100     10.3.0.3 → 224.0.0.5    OSPF 84 Hello Packet
  135 48.781047400     10.1.0.3 → 224.0.0.5    OSPF 84 Hello Packet
  136 48.781069900     10.1.0.3 → 224.0.0.5    OSPF 84 Hello Packet
  137 48.781607900     10.2.0.2 → 224.0.0.5    OSPF 84 Hello Packet
  138 48.781618500     10.2.0.2 → 224.0.0.5    OSPF 84 Hello Packet
  139 48.782564400     10.3.0.2 → 224.0.0.5    OSPF 84 Hello Packet
  140 48.782570200     10.3.0.2 → 224.0.0.5    OSPF 84 Hello Packet
  141 48.808194900     10.2.0.3 → 224.0.0.5    OSPF 84 Hello Packet
  142 50.080462800 02:42:0a:03:00:03 →              ARP 44 Who has 10.3.0.2? Tell 10.3.0.3
  143 50.080473600 02:42:0a:03:00:02 →              ARP 44 10.3.0.2 is at 02:42:0a:03:00:02
  144 53.672076400     10.1.0.3 → 10.1.0.2     OSPF 124 LS Update
  145 53.672369700     10.1.0.2 → 10.1.0.3     OSPF 124 LS Update
  146 53.672623900     10.2.0.2 → 224.0.0.5    OSPF 124 LS Update
  147 53.672640400     10.2.0.2 → 224.0.0.5    OSPF 124 LS Update
  148 53.672692600     10.3.0.2 → 224.0.0.5    OSPF 124 LS Update
  149 53.672699100     10.3.0.2 → 224.0.0.5    OSPF 124 LS Update
  150 53.676394700     10.3.0.2 → 10.3.0.3     OSPF 124 LS Update
  151 53.676468300     10.3.0.3 → 10.3.0.2     OSPF 124 LS Update
  152 53.676527300     10.1.0.3 → 224.0.0.5    OSPF 124 LS Update
  153 53.676536900     10.1.0.3 → 224.0.0.5    OSPF 124 LS Update
  154 53.676552800     10.2.0.2 → 224.0.0.5    OSPF 124 LS Update
  155 53.676559700     10.2.0.2 → 224.0.0.5    OSPF 124 LS Update
  156 53.676624100     10.1.0.2 → 224.0.0.5    OSPF 80 LS Acknowledge
  157 53.682454500     10.3.0.3 → 224.0.0.5    OSPF 100 LS Acknowledge
  158 53.780964900     10.2.0.3 → 10.2.0.2     OSPF 124 LS Update
  159 53.781071200     10.2.0.2 → 10.2.0.3     OSPF 124 LS Update
  160 53.781101600     10.1.0.3 → 224.0.0.5    OSPF 124 LS Update
  161 53.781110000     10.1.0.3 → 224.0.0.5    OSPF 124 LS Update
  162 53.781166500     10.3.0.2 → 224.0.0.5    OSPF 124 LS Update
  163 53.781172700     10.3.0.2 → 224.0.0.5    OSPF 124 LS Update
  164 53.786429300     10.1.0.3 → 224.0.0.5    OSPF 80 LS Acknowledge
  165 53.786439400     10.1.0.3 → 224.0.0.5    OSPF 80 LS Acknowledge
  166 53.786476600     10.2.0.2 → 224.0.0.5    OSPF 80 LS Acknowledge
  167 53.786483400     10.2.0.2 → 224.0.0.5    OSPF 80 LS Acknowledge
  168 53.786519300     10.3.0.2 → 224.0.0.5    OSPF 80 LS Acknowledge
  169 53.786523800     10.3.0.2 → 224.0.0.5    OSPF 80 LS Acknowledge
  170 53.811049500     10.2.0.3 → 224.0.0.5    OSPF 120 LS Acknowledge
  171 54.676948800     10.1.0.2 → 224.0.0.5    OSPF 100 LS Acknowledge
  172 54.682474400     10.3.0.3 → 224.0.0.5    OSPF 80 LS Acknowledge
  173 58.671733600     10.1.0.2 → 224.0.0.5    OSPF 84 Hello Packet
  174 58.676499500     10.3.0.3 → 224.0.0.5    OSPF 84 Hello Packet
  175 58.720964500 02:42:0a:01:00:02 →              ARP 44 Who has 10.1.0.3? Tell 10.1.0.2
  176 58.720976100 02:42:0a:01:00:03 →              ARP 44 10.1.0.3 is at 02:42:0a:01:00:03
  177 58.781176200     10.1.0.3 → 224.0.0.5    OSPF 84 Hello Packet
  178 58.781196900     10.1.0.3 → 224.0.0.5    OSPF 84 Hello Packet
  179 58.781572000     10.2.0.2 → 224.0.0.5    OSPF 84 Hello Packet
  180 58.781583300     10.2.0.2 → 224.0.0.5    OSPF 84 Hello Packet
  181 58.782528600     10.3.0.2 → 224.0.0.5    OSPF 84 Hello Packet
  182 58.782536500     10.3.0.2 → 224.0.0.5    OSPF 84 Hello Packet
  183 58.808139000     10.2.0.3 → 224.0.0.5    OSPF 84 Hello Packet
  184 61.680840000     10.3.0.1 → 10.200.0.3   TCP 76 43933 → 5140 [SYN] Seq=0 Win=64240 Len=0 MSS=1460 SACK_PERM=1 TSval=4111528032 TSecr=0 WS=128
  185 61.680855900     10.3.0.1 → 10.200.0.3   TCP 76 [TCP Out-Of-Order] [TCP Port numbers reused] 43933 → 5140 [SYN] Seq=0 Win=64240 Len=0 MSS=1460 SACK_PERM=1 TSval=4111528032 TSecr=0 WS=128
  186 62.320916700     10.1.0.3 → 10.200.0.3   TCP 76 [TCP Retransmission] [TCP Port numbers reused] 35547 → 5140 [SYN] Seq=0 Win=64240 Len=0 MSS=1460 SACK_PERM=1 TSval=4092381614 TSecr=0 WS=128
  187 62.320909400 fe80::b007:e5ff:fe5d:12a0 → ff02::2      ICMPv6 72 Router Solicitation from b2:07:e5:5d:12:a0
  188 62.320909400 fe80::a465:b1ff:fea7:8609 → ff02::2      ICMPv6 72 Router Solicitation from a6:65:b1:a7:86:09
  189 62.320909400 fe80::e883:46ff:fe1b:27e3 → ff02::2      ICMPv6 72 Router Solicitation from ea:83:46:1b:27:e3
  190 62.321021700   10.200.0.3 → 10.1.0.3     TCP 76 5140 → 35547 [SYN, ACK] Seq=0 Ack=1 Win=65160 Len=0 MSS=1460 SACK_PERM=1 TSval=1241596254 TSecr=4092381614 WS=128
  191 62.321029400     10.2.0.1 → 10.200.0.3   TCP 76 35879 → 5140 [SYN] Seq=0 Win=64240 Len=0 MSS=1460 SACK_PERM=1 TSval=1005263803 TSecr=0 WS=128
  192 62.321042900     10.2.0.1 → 10.200.0.3   TCP 76 [TCP Out-Of-Order] [TCP Port numbers reused] 35879 → 5140 [SYN] Seq=0 Win=64240 Len=0 MSS=1460 SACK_PERM=1 TSval=1005263803 TSecr=0 WS=128
  193 62.321043100     10.1.0.3 → 10.200.0.3   TCP 68 35547 → 5140 [ACK] Seq=1 Ack=1 Win=64256 Len=0 TSval=4092381614 TSecr=1241596254
  194 62.321551000     10.1.0.3 → 10.200.0.3   TCP 151 35547 → 5140 [PSH, ACK] Seq=1 Ack=1 Win=64256 Len=83 TSval=4092381614 TSecr=1241596254
  195 62.321662100   10.200.0.3 → 10.1.0.3     TCP 68 5140 → 35547 [ACK] Seq=1 Ack=84 Win=65152 Len=0 TSval=1241596254 TSecr=4092381614
  196 62.321687100     10.1.0.3 → 10.200.0.3   TCP 153 35547 → 5140 [PSH, ACK] Seq=84 Ack=1 Win=64256 Len=85 TSval=4092381615 TSecr=1241596254
  197 62.321716400   10.200.0.3 → 10.1.0.3     TCP 68 5140 → 35547 [ACK] Seq=1 Ack=169 Win=65152 Len=0 TSval=1241596255 TSecr=4092381615
  198 62.321730300     10.1.0.3 → 10.200.0.3   TCP 180 35547 → 5140 [PSH, ACK] Seq=169 Ack=1 Win=64256 Len=112 TSval=4092381615 TSecr=1241596255
  199 62.321753900   10.200.0.3 → 10.1.0.3     TCP 68 5140 → 35547 [ACK] Seq=1 Ack=281 Win=65152 Len=0 TSval=1241596255 TSecr=4092381615
  200 62.321762600     10.1.0.3 → 10.200.0.3   TCP 179 35547 → 5140 [PSH, ACK] Seq=281 Ack=1 Win=64256 Len=111 TSval=4092381615 TSecr=1241596255
  201 62.321782600   10.200.0.3 → 10.1.0.3     TCP 68 5140 → 35547 [ACK] Seq=1 Ack=392 Win=65152 Len=0 TSval=1241596255 TSecr=4092381615
  202 62.321790100     10.1.0.3 → 10.200.0.3   TCP 180 35547 → 5140 [PSH, ACK] Seq=392 Ack=1 Win=64256 Len=112 TSval=4092381615 TSecr=1241596255
  203 62.321803800   10.200.0.3 → 10.1.0.3     TCP 68 5140 → 35547 [ACK] Seq=1 Ack=504 Win=65152 Len=0 TSval=1241596255 TSecr=4092381615
  204 62.321809100     10.1.0.3 → 10.200.0.3   TCP 182 35547 → 5140 [PSH, ACK] Seq=504 Ack=1 Win=64256 Len=114 TSval=4092381615 TSecr=1241596255
  205 62.321820800   10.200.0.3 → 10.1.0.3     TCP 68 5140 → 35547 [ACK] Seq=1 Ack=618 Win=65152 Len=0 TSval=1241596255 TSecr=4092381615
  206 62.321825800     10.1.0.3 → 10.200.0.3   TCP 197 35547 → 5140 [PSH, ACK] Seq=618 Ack=1 Win=64256 Len=129 TSval=4092381615 TSecr=1241596255
  207 62.321837300   10.200.0.3 → 10.1.0.3     TCP 68 5140 → 35547 [ACK] Seq=1 Ack=747 Win=65024 Len=0 TSval=1241596255 TSecr=4092381615
  208 62.321842700     10.1.0.3 → 10.200.0.3   TCP 153 35547 → 5140 [PSH, ACK] Seq=747 Ack=1 Win=64256 Len=85 TSval=4092381615 TSecr=1241596255
  209 62.321853900   10.200.0.3 → 10.1.0.3     TCP 68 5140 → 35547 [ACK] Seq=1 Ack=832 Win=65024 Len=0 TSval=1241596255 TSecr=4092381615
  210 62.321858900     10.1.0.3 → 10.200.0.3   TCP 151 35547 → 5140 [PSH, ACK] Seq=832 Ack=1 Win=64256 Len=83 TSval=4092381615 TSecr=1241596255
  211 62.321870400   10.200.0.3 → 10.1.0.3     TCP 68 5140 → 35547 [ACK] Seq=1 Ack=915 Win=65024 Len=0 TSval=1241596255 TSecr=4092381615
  212 62.321875300     10.1.0.3 → 10.200.0.3   TCP 151 35547 → 5140 [PSH, ACK] Seq=915 Ack=1 Win=64256 Len=83 TSval=4092381615 TSecr=1241596255
  213 62.321886500   10.200.0.3 → 10.1.0.3     TCP 68 5140 → 35547 [ACK] Seq=1 Ack=998 Win=65024 Len=0 TSval=1241596255 TSecr=4092381615
  214 62.321891300     10.1.0.3 → 10.200.0.3   TCP 150 35547 → 5140 [PSH, ACK] Seq=998 Ack=1 Win=64256 Len=82 TSval=4092381615 TSecr=1241596255
  215 62.321902600   10.200.0.3 → 10.1.0.3     TCP 68 5140 → 35547 [ACK] Seq=1 Ack=1080 Win=65024 Len=0 TSval=1241596255 TSecr=4092381615
  216 62.321908300     10.1.0.3 → 10.200.0.3   TCP 158 35547 → 5140 [PSH, ACK] Seq=1080 Ack=1 Win=64256 Len=90 TSval=4092381615 TSecr=1241596255
  217 62.321919700   10.200.0.3 → 10.1.0.3     TCP 68 5140 → 35547 [ACK] Seq=1 Ack=1170 Win=65024 Len=0 TSval=1241596255 TSecr=4092381615
  218 62.321924600     10.1.0.3 → 10.200.0.3   TCP 158 35547 → 5140 [PSH, ACK] Seq=1170 Ack=1 Win=64256 Len=90 TSval=4092381615 TSecr=1241596255
  219 62.321935900   10.200.0.3 → 10.1.0.3     TCP 68 5140 → 35547 [ACK] Seq=1 Ack=1260 Win=65024 Len=0 TSval=1241596255 TSecr=4092381615
  220 62.321941000     10.1.0.3 → 10.200.0.3   TCP 157 35547 → 5140 [PSH, ACK] Seq=1260 Ack=1 Win=64256 Len=89 TSval=4092381615 TSecr=1241596255
  221 62.321952400   10.200.0.3 → 10.1.0.3     TCP 68 5140 → 35547 [ACK] Seq=1 Ack=1349 Win=65024 Len=0 TSval=1241596255 TSecr=4092381615
  222 62.321957600     10.1.0.3 → 10.200.0.3   TCP 160 35547 → 5140 [PSH, ACK] Seq=1349 Ack=1 Win=64256 Len=92 TSval=4092381615 TSecr=1241596255
  223 62.321969000   10.200.0.3 → 10.1.0.3     TCP 68 5140 → 35547 [ACK] Seq=1 Ack=1441 Win=65024 Len=0 TSval=1241596255 TSecr=4092381615
  224 62.321974000     10.1.0.3 → 10.200.0.3   TCP 162 35547 → 5140 [PSH, ACK] Seq=1441 Ack=1 Win=64256 Len=94 TSval=4092381615 TSecr=1241596255
  225 62.321985300   10.200.0.3 → 10.1.0.3     TCP 68 5140 → 35547 [ACK] Seq=1 Ack=1535 Win=65024 Len=0 TSval=1241596255 TSecr=4092381615
  226 62.321990100     10.1.0.3 → 10.200.0.3   TCP 161 35547 → 5140 [PSH, ACK] Seq=1535 Ack=1 Win=64256 Len=93 TSval=4092381615 TSecr=1241596255
  227 62.323042800   10.200.0.3 → 10.1.0.3     TCP 68 5140 → 35547 [ACK] Seq=1 Ack=1628 Win=65024 Len=0 TSval=1241596256 TSecr=4092381615
  228 62.323050500     10.1.0.3 → 10.200.0.3   TCP 687 35547 → 5140 [PSH, ACK] Seq=1628 Ack=1 Win=64256 Len=619 TSval=4092381616 TSecr=1241596256
  229 62.370851100   10.200.0.3 → 10.1.0.3     TCP 68 5140 → 35547 [ACK] Seq=1 Ack=2247 Win=64512 Len=0 TSval=1241596304 TSecr=4092381616
  230 67.360985800 02:42:0a:02:00:03 →              ARP 44 Who has 10.2.0.2? Tell 10.2.0.3
  231 67.360997100 02:42:0a:02:00:02 →              ARP 44 10.2.0.2 is at 02:42:0a:02:00:02
  232 68.671737100     10.1.0.2 → 224.0.0.5    OSPF 84 Hello Packet
  233 68.676536000     10.3.0.3 → 224.0.0.5    OSPF 84 Hello Packet
  234 68.781201500     10.1.0.3 → 224.0.0.5    OSPF 84 Hello Packet
  235 68.781220100     10.1.0.3 → 224.0.0.5    OSPF 84 Hello Packet
  236 68.781576900     10.2.0.2 → 224.0.0.5    OSPF 84 Hello Packet
  237 68.781586800     10.2.0.2 → 224.0.0.5    OSPF 84 Hello Packet
  238 68.782537700     10.3.0.2 → 224.0.0.5    OSPF 84 Hello Packet
  239 68.782546000     10.3.0.2 → 224.0.0.5    OSPF 84 Hello Packet
  240 68.808169400     10.2.0.3 → 224.0.0.5    OSPF 84 Hello Packet
  241 78.671741600     10.1.0.2 → 224.0.0.5    OSPF 84 Hello Packet
  242 78.676805900     10.3.0.3 → 224.0.0.5    OSPF 84 Hello Packet
  243 78.781228400     10.1.0.3 → 224.0.0.5    OSPF 84 Hello Packet
  244 78.781252600     10.1.0.3 → 224.0.0.5    OSPF 84 Hello Packet
  245 78.781583600     10.2.0.2 → 224.0.0.5    OSPF 84 Hello Packet
  246 78.781595500     10.2.0.2 → 224.0.0.5    OSPF 84 Hello Packet
  247 78.782541500     10.3.0.2 → 224.0.0.5    OSPF 84 Hello Packet
  248 78.782550200     10.3.0.2 → 224.0.0.5    OSPF 84 Hello Packet
  249 78.808169400     10.2.0.3 → 224.0.0.5    OSPF 84 Hello Packet
  250 88.671860700     10.1.0.2 → 224.0.0.5    OSPF 84 Hello Packet
  251 88.677179800     10.3.0.3 → 224.0.0.5    OSPF 84 Hello Packet
  252 88.781362200     10.1.0.3 → 224.0.0.5    OSPF 84 Hello Packet
  253 88.781383900     10.1.0.3 → 224.0.0.5    OSPF 84 Hello Packet
  254 88.781706200     10.2.0.2 → 224.0.0.5    OSPF 84 Hello Packet
  255 88.781718600     10.2.0.2 → 224.0.0.5    OSPF 84 Hello Packet
  256 88.782663000     10.3.0.2 → 224.0.0.5    OSPF 84 Hello Packet
  257 88.782669400     10.3.0.2 → 224.0.0.5    OSPF 84 Hello Packet
  258 88.808319500     10.2.0.3 → 224.0.0.5    OSPF 84 Hello Packet
  259 98.671865900     10.1.0.2 → 224.0.0.5    OSPF 84 Hello Packet
  260 98.677181700     10.3.0.3 → 224.0.0.5    OSPF 84 Hello Packet
  261 98.781505100     10.1.0.3 → 224.0.0.5    OSPF 84 Hello Packet
  262 98.781526500     10.1.0.3 → 224.0.0.5    OSPF 84 Hello Packet
  263 98.781712000     10.2.0.2 → 224.0.0.5    OSPF 84 Hello Packet
  264 98.781724000     10.2.0.2 → 224.0.0.5    OSPF 84 Hello Packet
  265 98.782670100     10.3.0.2 → 224.0.0.5    OSPF 84 Hello Packet
  266 98.782677600     10.3.0.2 → 224.0.0.5    OSPF 84 Hello Packet
  267 98.808347600     10.2.0.3 → 224.0.0.5    OSPF 84 Hello Packet
  268 104.991184500     10.1.0.3 → 10.200.0.3   TCP 140 35547 → 5140 [PSH, ACK] Seq=2247 Ack=1 Win=64256 Len=72 TSval=4092424284 TSecr=1241596304
  269 104.991259400   10.200.0.3 → 10.1.0.3     TCP 68 5140 → 35547 [ACK] Seq=1 Ack=2319 Win=64512 Len=0 TSval=1241638924 TSecr=4092424284
  270 108.671871100     10.1.0.2 → 224.0.0.5    OSPF 84 Hello Packet
  271 108.677202700     10.3.0.3 → 224.0.0.5    OSPF 84 Hello Packet
  272 108.781535300     10.1.0.3 → 224.0.0.5    OSPF 84 Hello Packet
  273 108.781556600     10.1.0.3 → 224.0.0.5    OSPF 84 Hello Packet
  274 108.781716300     10.2.0.2 → 224.0.0.5    OSPF 84 Hello Packet
  275 108.781727400     10.2.0.2 → 224.0.0.5    OSPF 84 Hello Packet
  276 108.782677100     10.3.0.2 → 224.0.0.5    OSPF 84 Hello Packet
  277 108.782685300     10.3.0.2 → 224.0.0.5    OSPF 84 Hello Packet
  278 108.808354500     10.2.0.3 → 224.0.0.5    OSPF 84 Hello Packet
  279 110.001091400 02:42:0a:01:00:03 →              ARP 44 Who has 10.1.0.2? Tell 10.1.0.3
  280 110.001180300 02:42:0a:01:00:02 →              ARP 44 Who has 10.1.0.3? Tell 10.1.0.2
  281 110.001190000 02:42:0a:01:00:03 →              ARP 44 10.1.0.3 is at 02:42:0a:01:00:03
  282 110.001198900 02:42:0a:01:00:02 →              ARP 44 10.1.0.2 is at 02:42:0a:01:00:02
  283 118.671860500     10.1.0.2 → 224.0.0.5    OSPF 84 Hello Packet
  284 118.677177300     10.3.0.3 → 224.0.0.5    OSPF 84 Hello Packet
  285 118.781657300     10.1.0.3 → 224.0.0.5    OSPF 84 Hello Packet
  286 118.781678700     10.1.0.3 → 224.0.0.5    OSPF 84 Hello Packet
  287 118.781752400     10.2.0.2 → 224.0.0.5    OSPF 84 Hello Packet
  288 118.781762800     10.2.0.2 → 224.0.0.5    OSPF 84 Hello Packet
  289 118.782667300     10.3.0.2 → 224.0.0.5    OSPF 84 Hello Packet
  290 118.782674700     10.3.0.2 → 224.0.0.5    OSPF 84 Hello Packet
  291 118.808369400     10.2.0.3 → 224.0.0.5    OSPF 84 Hello Packet
  292 128.671880300     10.1.0.2 → 224.0.0.5    OSPF 84 Hello Packet
  293 128.677208100     10.3.0.3 → 224.0.0.5    OSPF 84 Hello Packet
  294 128.781743300     10.1.0.3 → 224.0.0.5    OSPF 84 Hello Packet
  295 128.781763200     10.1.0.3 → 224.0.0.5    OSPF 84 Hello Packet
  296 128.781858200     10.2.0.2 → 224.0.0.5    OSPF 84 Hello Packet
  297 128.781869900     10.2.0.2 → 224.0.0.5    OSPF 84 Hello Packet
  298 128.782677200     10.3.0.2 → 224.0.0.5    OSPF 84 Hello Packet
  299 128.782686100     10.3.0.2 → 224.0.0.5    OSPF 84 Hello Packet
  300 128.808413500     10.2.0.3 → 224.0.0.5    OSPF 84 Hello Packet
  301 130.160918300 fe80::e883:46ff:fe1b:27e3 → ff02::2      ICMPv6 72 Router Solicitation from ea:83:46:1b:27:e3
  302 130.160918300 fe80::a465:b1ff:fea7:8609 → ff02::2      ICMPv6 72 Router Solicitation from a6:65:b1:a7:86:09
  303 135.280487500 fe80::b007:e5ff:fe5d:12a0 → ff02::2      ICMPv6 72 Router Solicitation from b2:07:e5:5d:12:a0
  304 138.671875100     10.1.0.2 → 224.0.0.5    OSPF 84 Hello Packet
  305 138.677228300     10.3.0.3 → 224.0.0.5    OSPF 84 Hello Packet
  306 138.781762200     10.1.0.3 → 224.0.0.5    OSPF 84 Hello Packet
  307 138.781783000     10.1.0.3 → 224.0.0.5    OSPF 84 Hello Packet
  308 138.781859400     10.2.0.2 → 224.0.0.5    OSPF 84 Hello Packet
  309 138.781869900     10.2.0.2 → 224.0.0.5    OSPF 84 Hello Packet
  310 138.782683500     10.3.0.2 → 224.0.0.5    OSPF 84 Hello Packet
  311 138.782691900     10.3.0.2 → 224.0.0.5    OSPF 84 Hello Packet
  312 138.808836200     10.2.0.3 → 224.0.0.5    OSPF 84 Hello Packet
  313 148.671831700     10.1.0.2 → 224.0.0.5    OSPF 84 Hello Packet
  314 148.677206600     10.3.0.3 → 224.0.0.5    OSPF 84 Hello Packet
  315 148.781720600     10.1.0.3 → 224.0.0.5    OSPF 84 Hello Packet
  316 148.781741600     10.1.0.3 → 224.0.0.5    OSPF 84 Hello Packet
  317 148.781809800     10.2.0.2 → 224.0.0.5    OSPF 84 Hello Packet
  318 148.781819500     10.2.0.2 → 224.0.0.5    OSPF 84 Hello Packet
  319 148.782632000     10.3.0.2 → 224.0.0.5    OSPF 84 Hello Packet
  320 148.782638100     10.3.0.2 → 224.0.0.5    OSPF 84 Hello Packet
  321 148.808773500     10.2.0.3 → 224.0.0.5    OSPF 84 Hello Packet
  322 158.672225600     10.1.0.2 → 224.0.0.5    OSPF 84 Hello Packet
  323 158.677274500     10.3.0.3 → 224.0.0.5    OSPF 84 Hello Packet
  324 158.782086900     10.1.0.3 → 224.0.0.5    OSPF 84 Hello Packet
  325 158.782105900     10.1.0.3 → 224.0.0.5    OSPF 84 Hello Packet
  326 158.782164700     10.2.0.2 → 224.0.0.5    OSPF 84 Hello Packet
  327 158.782174200     10.2.0.2 → 224.0.0.5    OSPF 84 Hello Packet
  328 158.782641700     10.3.0.2 → 224.0.0.5    OSPF 84 Hello Packet
  329 158.782650800     10.3.0.2 → 224.0.0.5    OSPF 84 Hello Packet
  330 158.808987000     10.2.0.3 → 224.0.0.5    OSPF 84 Hello Packet
  331 166.011225400     10.1.0.3 → 10.200.0.3   TCP 140 35547 → 5140 [PSH, ACK] Seq=2319 Ack=1 Win=64256 Len=72 TSval=4092485304 TSecr=1241638924
  332 166.011336700   10.200.0.3 → 10.1.0.3     TCP 68 5140 → 35547 [ACK] Seq=1 Ack=2391 Win=64512 Len=0 TSval=1241699944 TSecr=4092485304
  333 168.672224700     10.1.0.2 → 224.0.0.5    OSPF 84 Hello Packet
  334 168.677256800     10.3.0.3 → 224.0.0.5    OSPF 84 Hello Packet
  335 168.782103000     10.1.0.3 → 224.0.0.5    OSPF 84 Hello Packet
  336 168.782124400     10.1.0.3 → 224.0.0.5    OSPF 84 Hello Packet
  337 168.782174200     10.2.0.2 → 224.0.0.5    OSPF 84 Hello Packet
  338 168.782183400     10.2.0.2 → 224.0.0.5    OSPF 84 Hello Packet
  339 168.782643400     10.3.0.2 → 224.0.0.5    OSPF 84 Hello Packet
  340 168.782649600     10.3.0.2 → 224.0.0.5    OSPF 84 Hello Packet
  341 168.809006300     10.2.0.3 → 224.0.0.5    OSPF 84 Hello Packet
  342 171.040490600 02:42:0a:01:00:03 →              ARP 44 Who has 10.1.0.2? Tell 10.1.0.3
  343 171.040550000 02:42:0a:01:00:02 →              ARP 44 Who has 10.1.0.3? Tell 10.1.0.2
  344 171.040561200 02:42:0a:01:00:03 →              ARP 44 10.1.0.3 is at 02:42:0a:01:00:03
  345 171.040572400 02:42:0a:01:00:02 →              ARP 44 10.1.0.2 is at 02:42:0a:01:00:02
  346 178.672356100     10.1.0.2 → 224.0.0.5    OSPF 84 Hello Packet
  347 178.677408300     10.3.0.3 → 224.0.0.5    OSPF 84 Hello Packet
  348 178.782235400     10.1.0.3 → 224.0.0.5    OSPF 84 Hello Packet
  349 178.782257000     10.1.0.3 → 224.0.0.5    OSPF 84 Hello Packet
  350 178.782313700     10.2.0.2 → 224.0.0.5    OSPF 84 Hello Packet
  351 178.782323000     10.2.0.2 → 224.0.0.5    OSPF 84 Hello Packet
  352 178.782758900     10.3.0.2 → 224.0.0.5    OSPF 84 Hello Packet
  353 178.782767600     10.3.0.2 → 224.0.0.5    OSPF 84 Hello Packet
  354 178.809194000     10.2.0.3 → 224.0.0.5    OSPF 84 Hello Packet
  355 188.672371700     10.1.0.2 → 224.0.0.5    OSPF 84 Hello Packet
  356 188.677419400     10.3.0.3 → 224.0.0.5    OSPF 84 Hello Packet
  357 188.782259100     10.1.0.3 → 224.0.0.5    OSPF 84 Hello Packet
  358 188.782276700     10.1.0.3 → 224.0.0.5    OSPF 84 Hello Packet
  359 188.782323600     10.2.0.2 → 224.0.0.5    OSPF 84 Hello Packet
  360 188.782335200     10.2.0.2 → 224.0.0.5    OSPF 84 Hello Packet
  361 188.782762300     10.3.0.2 → 224.0.0.5    OSPF 84 Hello Packet
  362 188.782769000     10.3.0.2 → 224.0.0.5    OSPF 84 Hello Packet
  363 188.809216900     10.2.0.3 → 224.0.0.5    OSPF 84 Hello Packet
  364 190.174252000     10.2.0.3 → 10.200.0.3   TCP 76 36781 → 5140 [SYN] Seq=0 Win=64240 Len=0 MSS=1460 SACK_PERM=1 TSval=649564195 TSecr=0 WS=128
  365 190.174266000     10.2.0.3 → 10.200.0.3   TCP 76 [TCP Out-Of-Order] [TCP Port numbers reused] 36781 → 5140 [SYN] Seq=0 Win=64240 Len=0 MSS=1460 SACK_PERM=1 TSval=649564195 TSecr=0 WS=128
  366 190.174338300   10.200.0.3 → 10.2.0.3     TCP 76 5140 → 36781 [SYN, ACK] Seq=0 Ack=1 Win=65160 Len=0 MSS=1460 SACK_PERM=1 TSval=1273024664 TSecr=649564195 WS=128
  367 190.174342100   10.200.0.3 → 10.2.0.3     TCP 76 [TCP Out-Of-Order] 5140 → 36781 [SYN, ACK] Seq=0 Ack=1 Win=65160 Len=0 MSS=1460 SACK_PERM=1 TSval=1273024664 TSecr=649564195 WS=128
  368 190.174360000     10.2.0.3 → 10.200.0.3   TCP 68 36781 → 5140 [ACK] Seq=1 Ack=1 Win=64256 Len=0 TSval=649564195 TSecr=1273024664
  369 190.174361800     10.2.0.3 → 10.200.0.3   TCP 68 [TCP Dup ACK 368#1] 36781 → 5140 [ACK] Seq=1 Ack=1 Win=64256 Len=0 TSval=649564195 TSecr=1273024664
  370 190.174810100     10.2.0.3 → 10.200.0.3   TCP 151 36781 → 5140 [PSH, ACK] Seq=1 Ack=1 Win=64256 Len=83 TSval=649564195 TSecr=1273024664
  371 190.174825600     10.2.0.3 → 10.200.0.3   TCP 151 [TCP Retransmission] 36781 → 5140 [PSH, ACK] Seq=1 Ack=1 Win=64256 Len=83 TSval=649564195 TSecr=1273024664
  372 190.174918900   10.200.0.3 → 10.2.0.3     TCP 68 5140 → 36781 [ACK] Seq=1 Ack=84 Win=65152 Len=0 TSval=1273024665 TSecr=649564195
  373 190.174924000   10.200.0.3 → 10.2.0.3     TCP 68 [TCP Dup ACK 372#1] 5140 → 36781 [ACK] Seq=1 Ack=84 Win=65152 Len=0 TSval=1273024665 TSecr=649564195
  374 190.174956300     10.2.0.3 → 10.200.0.3   TCP 153 36781 → 5140 [PSH, ACK] Seq=84 Ack=1 Win=64256 Len=85 TSval=649564196 TSecr=1273024665
  375 190.174958700     10.2.0.3 → 10.200.0.3   TCP 153 [TCP Retransmission] 36781 → 5140 [PSH, ACK] Seq=84 Ack=1 Win=64256 Len=85 TSval=649564196 TSecr=1273024665
  376 190.174972800   10.200.0.3 → 10.2.0.3     TCP 68 5140 → 36781 [ACK] Seq=1 Ack=169 Win=65152 Len=0 TSval=1273024665 TSecr=649564196
  377 190.174974000   10.200.0.3 → 10.2.0.3     TCP 68 [TCP Dup ACK 376#1] 5140 → 36781 [ACK] Seq=1 Ack=169 Win=65152 Len=0 TSval=1273024665 TSecr=649564196
  378 190.174985200     10.2.0.3 → 10.200.0.3   TCP 180 36781 → 5140 [PSH, ACK] Seq=169 Ack=1 Win=64256 Len=112 TSval=649564196 TSecr=1273024665
  379 190.174986800     10.2.0.3 → 10.200.0.3   TCP 180 [TCP Retransmission] 36781 → 5140 [PSH, ACK] Seq=169 Ack=1 Win=64256 Len=112 TSval=649564196 TSecr=1273024665
  380 190.174999000   10.200.0.3 → 10.2.0.3     TCP 68 5140 → 36781 [ACK] Seq=1 Ack=281 Win=65152 Len=0 TSval=1273024665 TSecr=649564196
  381 190.175000200   10.200.0.3 → 10.2.0.3     TCP 68 [TCP Dup ACK 380#1] 5140 → 36781 [ACK] Seq=1 Ack=281 Win=65152 Len=0 TSval=1273024665 TSecr=649564196
  382 190.175010000     10.2.0.3 → 10.200.0.3   TCP 179 36781 → 5140 [PSH, ACK] Seq=281 Ack=1 Win=64256 Len=111 TSval=649564196 TSecr=1273024665
  383 190.175011400     10.2.0.3 → 10.200.0.3   TCP 179 [TCP Retransmission] 36781 → 5140 [PSH, ACK] Seq=281 Ack=1 Win=64256 Len=111 TSval=649564196 TSecr=1273024665
  384 190.175022600   10.200.0.3 → 10.2.0.3     TCP 68 5140 → 36781 [ACK] Seq=1 Ack=392 Win=65152 Len=0 TSval=1273024665 TSecr=649564196
  385 190.175023800   10.200.0.3 → 10.2.0.3     TCP 68 [TCP Dup ACK 384#1] 5140 → 36781 [ACK] Seq=1 Ack=392 Win=65152 Len=0 TSval=1273024665 TSecr=649564196
  386 190.175033600     10.2.0.3 → 10.200.0.3   TCP 180 36781 → 5140 [PSH, ACK] Seq=392 Ack=1 Win=64256 Len=112 TSval=649564196 TSecr=1273024665
  387 190.175034900     10.2.0.3 → 10.200.0.3   TCP 180 [TCP Retransmission] 36781 → 5140 [PSH, ACK] Seq=392 Ack=1 Win=64256 Len=112 TSval=649564196 TSecr=1273024665
  388 190.175045900   10.200.0.3 → 10.2.0.3     TCP 68 5140 → 36781 [ACK] Seq=1 Ack=504 Win=65152 Len=0 TSval=1273024665 TSecr=649564196
  389 190.175047100   10.200.0.3 → 10.2.0.3     TCP 68 [TCP Dup ACK 388#1] 5140 → 36781 [ACK] Seq=1 Ack=504 Win=65152 Len=0 TSval=1273024665 TSecr=649564196
  390 190.175056500     10.2.0.3 → 10.200.0.3   TCP 182 36781 → 5140 [PSH, ACK] Seq=504 Ack=1 Win=64256 Len=114 TSval=649564196 TSecr=1273024665
  391 190.175057800     10.2.0.3 → 10.200.0.3   TCP 182 [TCP Retransmission] 36781 → 5140 [PSH, ACK] Seq=504 Ack=1 Win=64256 Len=114 TSval=649564196 TSecr=1273024665
  392 190.175068800   10.200.0.3 → 10.2.0.3     TCP 68 5140 → 36781 [ACK] Seq=1 Ack=618 Win=65152 Len=0 TSval=1273024665 TSecr=649564196
  393 190.175070100   10.200.0.3 → 10.2.0.3     TCP 68 [TCP Dup ACK 392#1] 5140 → 36781 [ACK] Seq=1 Ack=618 Win=65152 Len=0 TSval=1273024665 TSecr=649564196
  394 190.175080000     10.2.0.3 → 10.200.0.3   TCP 197 36781 → 5140 [PSH, ACK] Seq=618 Ack=1 Win=64256 Len=129 TSval=649564196 TSecr=1273024665
  395 190.175081400     10.2.0.3 → 10.200.0.3   TCP 197 [TCP Retransmission] 36781 → 5140 [PSH, ACK] Seq=618 Ack=1 Win=64256 Len=129 TSval=649564196 TSecr=1273024665
  396 190.175092400   10.200.0.3 → 10.2.0.3     TCP 68 5140 → 36781 [ACK] Seq=1 Ack=747 Win=65024 Len=0 TSval=1273024665 TSecr=649564196
  397 190.175093600   10.200.0.3 → 10.2.0.3     TCP 68 [TCP Dup ACK 396#1] 5140 → 36781 [ACK] Seq=1 Ack=747 Win=65024 Len=0 TSval=1273024665 TSecr=649564196
  398 190.175100700     10.3.0.3 → 10.200.0.3   TCP 76 36109 → 5140 [SYN] Seq=0 Win=64240 Len=0 MSS=1460 SACK_PERM=1 TSval=541470739 TSecr=0 WS=128
  399 190.175102900     10.2.0.3 → 10.200.0.3   TCP 151 36781 → 5140 [PSH, ACK] Seq=747 Ack=1 Win=64256 Len=83 TSval=649564196 TSecr=1273024665
  400 190.175104300     10.2.0.3 → 10.200.0.3   TCP 151 [TCP Retransmission] 36781 → 5140 [PSH, ACK] Seq=747 Ack=1 Win=64256 Len=83 TSval=649564196 TSecr=1273024665
  401 190.175115200   10.200.0.3 → 10.2.0.3     TCP 68 5140 → 36781 [ACK] Seq=1 Ack=830 Win=65024 Len=0 TSval=1273024665 TSecr=649564196
  402 190.175116300   10.200.0.3 → 10.2.0.3     TCP 68 [TCP Dup ACK 401#1] 5140 → 36781 [ACK] Seq=1 Ack=830 Win=65024 Len=0 TSval=1273024665 TSecr=649564196
  403 190.175125600     10.2.0.3 → 10.200.0.3   TCP 153 36781 → 5140 [PSH, ACK] Seq=830 Ack=1 Win=64256 Len=85 TSval=649564196 TSecr=1273024665
  404 190.175126900     10.2.0.3 → 10.200.0.3   TCP 153 [TCP Retransmission] 36781 → 5140 [PSH, ACK] Seq=830 Ack=1 Win=64256 Len=85 TSval=649564196 TSecr=1273024665
  405 190.175130400     10.3.0.3 → 10.200.0.3   TCP 76 [TCP Out-Of-Order] [TCP Port numbers reused] 36109 → 5140 [SYN] Seq=0 Win=64240 Len=0 MSS=1460 SACK_PERM=1 TSval=541470739 TSecr=0 WS=128
  406 190.175138400   10.200.0.3 → 10.2.0.3     TCP 68 5140 → 36781 [ACK] Seq=1 Ack=915 Win=65024 Len=0 TSval=1273024665 TSecr=649564196
  407 190.175139700   10.200.0.3 → 10.2.0.3     TCP 68 [TCP Dup ACK 406#1] 5140 → 36781 [ACK] Seq=1 Ack=915 Win=65024 Len=0 TSval=1273024665 TSecr=649564196
  408 190.175149500     10.2.0.3 → 10.200.0.3   TCP 150 36781 → 5140 [PSH, ACK] Seq=915 Ack=1 Win=64256 Len=82 TSval=649564196 TSecr=1273024665
  409 190.175150800     10.2.0.3 → 10.200.0.3   TCP 150 [TCP Retransmission] 36781 → 5140 [PSH, ACK] Seq=915 Ack=1 Win=64256 Len=82 TSval=649564196 TSecr=1273024665
  410 190.175161700   10.200.0.3 → 10.2.0.3     TCP 68 5140 → 36781 [ACK] Seq=1 Ack=997 Win=65024 Len=0 TSval=1273024665 TSecr=649564196
  411 190.175162900   10.200.0.3 → 10.2.0.3     TCP 68 [TCP Dup ACK 410#1] 5140 → 36781 [ACK] Seq=1 Ack=997 Win=65024 Len=0 TSval=1273024665 TSecr=649564196
  412 190.175166600   10.200.0.3 → 10.3.0.3     TCP 76 5140 → 36109 [SYN, ACK] Seq=0 Ack=1 Win=65160 Len=0 MSS=1460 SACK_PERM=1 TSval=1869399138 TSecr=541470739 WS=128
  413 190.175170300   10.200.0.3 → 10.3.0.3     TCP 76 [TCP Out-Of-Order] 5140 → 36109 [SYN, ACK] Seq=0 Ack=1 Win=65160 Len=0 MSS=1460 SACK_PERM=1 TSval=1869399138 TSecr=541470739 WS=128
  414 190.175172200     10.2.0.3 → 10.200.0.3   TCP 151 36781 → 5140 [PSH, ACK] Seq=997 Ack=1 Win=64256 Len=83 TSval=649564196 TSecr=1273024665
  415 190.175173600     10.2.0.3 → 10.200.0.3   TCP 151 [TCP Retransmission] 36781 → 5140 [PSH, ACK] Seq=997 Ack=1 Win=64256 Len=83 TSval=649564196 TSecr=1273024665
  416 190.175184600   10.200.0.3 → 10.2.0.3     TCP 68 5140 → 36781 [ACK] Seq=1 Ack=1080 Win=65024 Len=0 TSval=1273024665 TSecr=649564196
  417 190.175185400     10.3.0.3 → 10.200.0.3   TCP 68 36109 → 5140 [ACK] Seq=1 Ack=1 Win=64256 Len=0 TSval=541470739 TSecr=1869399138
  418 190.175185700   10.200.0.3 → 10.2.0.3     TCP 68 [TCP Dup ACK 416#1] 5140 → 36781 [ACK] Seq=1 Ack=1080 Win=65024 Len=0 TSval=1273024665 TSecr=649564196
  419 190.175187000     10.3.0.3 → 10.200.0.3   TCP 68 [TCP Dup ACK 417#1] 36109 → 5140 [ACK] Seq=1 Ack=1 Win=64256 Len=0 TSval=541470739 TSecr=1869399138
  420 190.175196200     10.2.0.3 → 10.200.0.3   TCP 158 36781 → 5140 [PSH, ACK] Seq=1080 Ack=1 Win=64256 Len=90 TSval=649564196 TSecr=1273024665
  421 190.175197600     10.2.0.3 → 10.200.0.3   TCP 158 [TCP Retransmission] 36781 → 5140 [PSH, ACK] Seq=1080 Ack=1 Win=64256 Len=90 TSval=649564196 TSecr=1273024665
  422 190.175208700   10.200.0.3 → 10.2.0.3     TCP 68 5140 → 36781 [ACK] Seq=1 Ack=1170 Win=65024 Len=0 TSval=1273024665 TSecr=649564196
  423 190.175209800   10.200.0.3 → 10.2.0.3     TCP 68 [TCP Dup ACK 422#1] 5140 → 36781 [ACK] Seq=1 Ack=1170 Win=65024 Len=0 TSval=1273024665 TSecr=649564196
  424 190.175219800     10.2.0.3 → 10.200.0.3   TCP 158 36781 → 5140 [PSH, ACK] Seq=1170 Ack=1 Win=64256 Len=90 TSval=649564196 TSecr=1273024665
  425 190.175221100     10.2.0.3 → 10.200.0.3   TCP 158 [TCP Retransmission] 36781 → 5140 [PSH, ACK] Seq=1170 Ack=1 Win=64256 Len=90 TSval=649564196 TSecr=1273024665
  426 190.175232200   10.200.0.3 → 10.2.0.3     TCP 68 5140 → 36781 [ACK] Seq=1 Ack=1260 Win=65024 Len=0 TSval=1273024665 TSecr=649564196
